Club,Name,Date of birth/Age,Citizenship,Foot,Position,Joined,Contract expires,Competition_Total_Appearances,Competition_Total_Goals,Competition_Total_Own_Goals,Competition_Total_Assists,Competition_Total_Yellow_Cards,Competition_Total_Red_Cards,Competition_Total_Substitutions_On,Competition_Total_Substitutions_Off,Competition_Total_Clean_Sheets,Competition_Total_Goals_Conceded,Competition_Total_Minutes_Played,Competition_National_Appearances,Competition_National_Goals,Competition_National_Own_Goals,Competition_National_Assists,Competition_National_Yellow_Cards,Competition_National_Red_Cards,Competition_National_Substitutions_On,Competition_National_Substitutions_Off,Competition_National_Goals_Conceded,Competition_National_Clean_Sheets,Competition_National_Minutes_Played,Competition_International_Appearances,Competition_International_Goals,Competition_International_Own_Goals,Competition_International_Assists,Competition_International_Yellow_Cards,Competition_International_Red_Cards,Competition_International_Substitutions_On,Competition_International_Substitutions_Off,Competition_International_Clean_Sheets,Competition_International_Goals_Conceded,Competition_International_Minutes_Played,Competition_Nationalcup_Appearances,Competition_Nationalcup_Goals,Competition_Nationalcup_Own_Goals,Competition_Nationalcup_Assists,Competition_Nationalcup_Yellow_Cards,Competition_Nationalcup_Red_Cards,Competition_Nationalcup_Substitutions_On,Competition_Nationalcup_Substitutions_Off,Competition_Nationalcup_Clean_Sheets,Competition_Nationalcup_Goals_Conceded,Competition_Nationalcup_Minutes_Played,Height_m,Market_value_eur,Age_years,Birthdate,Contract_expires_date,Contract_months_remaining
Manchester City,Gianluigi Donnarumma,25/02/1999 (26),Italy,right,Goalkeeper,01/09/2025,30/06/2030,27,0,0,0,6,0,0,0,12,24,2.430',20,0,0,0,5,0,0,0,17,9,1.800',7,0,0,0,1,0,0,0,3,7,630',0,0,0,0,0,0,0,0,0,0,0,1.96,45000000.0,26.0,1999-02-25,2030-06-30,52.858081471747695
Manchester City,James Trafford,10/10/2002 (23),England,right,Goalkeeper,29/07/2025,30/06/2030,9,0,0,0,0,0,0,0,4,8,810',3,0,0,0,0,0,0,0,4,1,270',1,0,0,0,0,0,0,0,0,2,90',1,0,0,0,0,0,0,0,0,1,90',1.92,25000000.0,23.0,2002-10-10,2030-06-30,52.858081471747695
Manchester City,Stefan Ortega,06/11/1992 (33),Germany  Spain,right,Goalkeeper,01/07/2022,30/06/2026,0,0,0,0,0,0,0,0,0,0,0,0,0,0,0,0,0,0,0,0,0,0,0,0,0,0,0,0,0,0,0,0,0,0,0,0,0,0,0,0,0,0,0,0,1.85,5000000.0,33.0,1992-11-06,2026-06-30,4.862023653088042
Manchester City,Marcus Bettinelli,24/05/1992 (33),England  Italy,right,Goalkeeper,10/06/2025,30/06/2026,0,0,0,0,0,0,0,0,0,0,0,0,0,0,0,0,0,0,0,0,0,0,0,0,0,0,0,0,0,0,0,0,0,0,0,0,0,0,0,0,0,0,0,0,1.93,500000.0,33.0,1992-05-24,2026-06-30,4.862023653088042
Manchester City,Josko Gvardiol,23/01/2002 (24),Croatia,left,Defender - Centre-Back,05/08/2023,30/06/2028,23,2,0,5,2,0,3,4,0,0,1.796',16,2,0,2,2,0,1,3,0,0,1.304',5,0,0,2,0,0,0,1,0,0,440',0,0,0,0,0,0,0,0,0,0,0,1.85,70000000.0,24.0,2002-01-23,2028-06-30,28.876478318002626
Manchester City,Rúben Dias,14/05/1997 (28),Portugal,right,Defender - Centre-Back,29/09/2020,30/06/2029,25,2,0,0,3,0,2,1,0,0,2.077',20,2,0,0,2,0,1,1,0,0,1.706',5,0,0,0,1,0,1,0,0,0,371',0,0,0,0,0,0,0,0,0,0,0,1.87,60000000.0,28.0,1997-05-14,2029-06-30,40.86727989487516
Manchester City,Marc Guéhi,13/07/2000 (25),England  Cote d'Ivoire,right,Defender - Centre-Back,19/01/2026,30/06/2031,34,3,0,4,7,0,1,3,0,0,2.922',21,2,0,3,4,0,0,0,0,0,1.890',0,0,0,0,0,0,0,0,0,0,0,1,0,0,0,1,0,0,0,0,0,90',1.82,55000000.0,25.0,2000-07-13,2031-06-30,64.84888304862024
Manchester City,Abdukodir Khusanov,29/02/2004 (21),Uzbekistan,right,Defender - Centre-Back,20/01/2025,30/06/2029,17,0,0,0,2,0,3,4,0,0,1.228',9,0,0,0,1,0,3,2,0,0,560',4,0,0,0,0,0,0,1,0,0,335',1,0,0,0,0,0,0,0,0,0,90',1.86,35000000.0,21.0,2004-02-29,2029-06-30,40.86727989487516
Manchester City,John Stones,28/05/1994 (31),England,right,Defender - Centre-Back,09/08/2016,30/06/2026,13,0,0,0,0,0,4,3,0,0,813',7,0,0,0,0,0,3,2,0,0,353',4,0,0,0,0,0,0,1,0,0,343',0,0,0,0,0,0,0,0,0,0,0,1.88,18000000.0,31.0,1994-05-28,2026-06-30,4.862023653088042
Manchester City,Nathan Aké,18/02/1995 (30),Netherlands  Cote d'Ivoire,left,Defender - Centre-Back,05/08/2020,30/06/2027,21,0,0,0,1,0,10,3,0,0,1.081',12,0,0,0,1,0,8,1,0,0,485',4,0,0,0,0,0,2,0,0,0,193',1,0,0,0,0,0,0,1,0,0,45',1.8,18000000.0,30.0,1995-02-18,2027-06-30,16.852825229960576
Manchester City,Max Alleyne,21/07/2005 (20),England  Barbados,both,Defender - Centre-Back,06/01/2026,-,22,1,1,0,2,0,2,5,0,0,1.735',2,0,0,0,0,0,0,1,0,0,135',1,0,0,0,0,0,0,0,0,0,90',1,1,0,0,0,0,0,1,0,0,64',1.85,800000.0,20.0,2005-07-21,,0.0
Manchester City,Rayan Aït-Nouri,06/06/2001 (24),Algeria  France,left,Defender - Left-Back,09/06/2025,30/06/2030,12,0,0,2,2,0,5,3,0,0,509',6,0,0,0,1,0,3,1,0,0,215',4,0,0,0,0,0,1,1,0,0,229',0,0,0,0,0,0,0,0,0,0,0,1.8,40000000.0,24.0,2001-06-06,2030-06-30,52.858081471747695
Manchester City,Nico O'Reilly,21/03/2005 (20),England  Jamaica,left,Defender - Left-Back,01/07/2024,30/06/2030,33,3,0,5,7,0,7,9,0,0,2.444',22,1,0,3,4,0,5,5,0,0,1.615',7,1,0,2,2,0,1,1,0,0,581',1,1,0,0,0,0,1,0,0,0,45',1.93,40000000.0,20.0,2005-03-21,2030-06-30,52.858081471747695
Manchester City,Matheus Nunes,27/08/1998 (27),Portugal  Brazil,right,Defender - Right-Back,01/09/2023,30/06/2028,28,1,0,5,6,0,4,3,0,0,2.220',20,1,0,5,4,0,2,2,0,0,1.667',5,0,0,0,0,0,1,0,0,0,377',0,0,0,0,0,0,0,0,0,0,0,1.83,38000000.0,27.0,1998-08-27,2028-06-30,28.876478318002626
Manchester City,Rico Lewis,21/11/2004 (21),England  Jamaica,right,Defender - Right-Back,01/07/2022,30/06/2030,19,2,0,3,2,0,9,3,0,0,918',10,0,0,1,1,0,7,1,0,0,312',4,0,0,1,0,0,1,2,0,0,218',1,2,0,1,0,0,0,0,0,0,90',1.7,35000000.0,21.0,2004-11-21,2030-06-30,52.858081471747695
Manchester City,Rodri,22/06/1996 (29),Spain,right,Midfield - Defensive Midfield,04/07/2019,30/06/2027,16,1,0,0,2,0,5,5,0,0,891',11,0,0,0,1,0,4,2,0,0,635',3,0,0,0,1,0,0,2,0,0,183',1,1,0,0,0,0,0,1,0,0,45',1.91,75000000.0,29.0,1996-06-22,2027-06-30,16.852825229960576
Manchester City,Nico González,03/01/2002 (24),Spain,right,Midfield - Defensive Midfield,03/02/2025,30/06/2029,29,1,0,0,4,0,7,9,0,0,1.969',19,1,0,0,4,0,4,6,0,0,1.336',7,0,0,0,0,0,3,1,0,0,394',0,0,0,0,0,0,0,0,0,0,0,1.88,45000000.0,24.0,2002-01-03,2029-06-30,40.86727989487516
Manchester City,Kalvin Phillips,02/12/1995 (30),England  Jamaica,right,Midfield - Defensive Midfield,04/07/2022,30/06/2028,1,0,0,0,0,0,1,0,0,0,7',0,0,0,0,0,0,0,0,0,0,0,0,0,0,0,0,0,0,0,0,0,0,0,0,0,0,0,0,0,0,0,0,0,1.79,6000000.0,30.0,1995-12-02,2028-06-30,28.876478318002626
Manchester City,Tijjani Reijnders,29/07/1998 (27),Netherlands,right,Midfield - Central Midfield,10/06/2025,30/06/2030,34,6,0,7,2,0,10,13,0,0,2.123',22,5,0,2,2,0,5,11,0,0,1.413',8,0,0,3,0,0,3,2,0,0,489',1,1,0,1,0,0,0,0,0,0,90',1.85,65000000.0,27.0,1998-07-29,2030-06-30,52.858081471747695
Manchester City,Mateo Kovacic,06/05/1994 (31),Croatia,right,Midfield - Central Midfield,01/07/2023,30/06/2027,2,0,0,0,0,0,2,0,0,0,37',1,0,0,0,0,0,1,0,0,0,4',1,0,0,0,0,0,1,0,0,0,33',0,0,0,0,0,0,0,0,0,0,0,1.77,15000000.0,31.0,1994-05-06,2027-06-30,16.852825229960576
Manchester City,Phil Foden,28/05/2000 (25),England,left,Midfield - Attacking Midfield,01/07/2017,30/06/2027,32,10,0,4,4,0,6,12,0,0,2.383',21,7,0,2,3,0,2,7,0,0,1.646',7,2,0,1,1,0,2,2,0,0,508',0,0,0,0,0,0,0,0,0,0,0,1.71,80000000.0,25.0,2000-05-28,2027-06-30,16.852825229960576
Manchester City,Rayan Cherki,17/08/2003 (22),France  Algeria,both,Midfield - Attacking Midfield,10/06/2025,30/06/2030,28,8,0,9,2,0,11,11,0,0,1.501',18,2,0,7,1,0,7,8,0,0,959',6,3,0,0,1,0,3,2,0,0,283',1,0,0,1,0,0,0,0,0,0,90',1.77,50000000.0,22.0,2003-08-17,2030-06-30,52.858081471747695
Manchester City,Bernardo Silva,10/08/1994 (31),Portugal,left,Midfield - Attacking Midfield,01/07/2017,30/06/2026,32,1,0,4,8,0,7,12,0,0,2.274',23,0,0,3,4,0,4,12,0,0,1.673',6,1,0,0,3,0,1,0,0,0,461',1,0,0,0,0,0,1,0,0,0,26',1.73,27000000.0,31.0,1994-08-10,2026-06-30,4.862023653088042
Manchester City,Jérémy Doku,27/05/2002 (23),Belgium  Ghana,right,Attack - Left Winger,24/08/2023,30/06/2028,30,3,0,11,0,0,9,17,0,0,1.831',20,1,0,6,0,0,7,10,0,0,1.188',7,1,0,3,0,0,1,6,0,0,450',1,0,0,2,0,0,1,0,0,0,26',1.73,65000000.0,23.0,2002-05-27,2028-06-30,28.876478318002626
Manchester City,Savinho,10/04/2004 (21),Brazil,left,Attack - Left Winger,18/07/2024,30/06/2031,23,2,0,3,3,0,13,7,0,0,1.032',15,0,0,2,1,0,10,4,0,0,535',6,0,0,1,2,0,3,2,0,0,324',0,0,0,0,0,0,0,0,0,0,0,1.76,45000000.0,21.0,2004-04-10,2031-06-30,64.84888304862024
Manchester City,Antoine Semenyo,07/01/2000 (26),Ghana  England,right,Attack - Right Winger,09/01/2026,30/06/2031,25,13,0,4,6,0,1,3,0,0,2.179',22,11,0,3,6,0,0,2,0,0,1.980',0,0,0,0,0,0,0,0,0,0,0,1,1,0,1,0,0,0,1,0,0,64',1.85,65000000.0,26.0,2000-01-07,2031-06-30,64.84888304862024
Manchester City,Erling Haaland,21/07/2000 (25),Norway,left,Attack - Centre-Forward,01/07/2022,30/06/2034,33,27,0,4,0,0,2,12,0,0,2.676',23,20,0,4,0,0,1,7,0,0,1.924',8,7,0,0,0,0,1,4,0,0,617',1,0,0,0,0,0,0,1,0,0,45',1.95,200000000.0,25.0,2000-07-21,2034-06-30,100.85413929040736
Manchester City,Omar Marmoush,07/02/1999 (26),Egypt  Canada,right,Attack - Centre-Forward,23/01/2025,30/06/2029,18,2,0,1,0,0,12,5,0,0,550',11,1,0,1,0,0,8,3,0,0,280',6,0,0,0,0,0,4,2,0,0,180',0,0,0,0,0,0,0,0,0,0,0,1.83,65000000.0,26.0,1999-02-07,2029-06-30,40.86727989487516
Arsenal FC,David Raya,15/09/1995 (30),Spain,right,Goalkeeper,04/07/2024,30/06/2028,31,0,0,0,1,0,0,0,17,19,2.790',24,0,0,0,1,0,0,0,17,12,2.160',7,0,0,0,0,0,0,0,5,2,630',0,0,0,0,0,0,0,0,0,0,0,1.83,35000000.0,30.0,1995-09-15,2028-06-30,28.876478318002626
Arsenal FC,Kepa Arrizabalaga,03/10/1994 (31),Spain,right,Goalkeeper,01/07/2025,30/06/2028,6,0,0,0,2,0,0,0,2,6,540',0,0,0,0,0,0,0,0,0,0,0,1,0,0,0,0,0,0,0,0,2,90',1,0,0,0,0,0,0,0,0,1,90',1.88,7000000.0,31.0,1994-10-03,2028-06-30,28.876478318002626
Arsenal FC,William Saliba,24/03/2001 (24),France  Cameroon,right,Defender - Centre-Back,25/07/2019,30/06/2030,28,0,0,1,1,0,1,2,0,0,2.345',20,0,0,0,0,0,1,2,0,0,1.625',5,0,0,0,1,0,0,0,0,0,450',0,0,0,0,0,0,0,0,0,0,0,1.92,90000000.0,24.0,2001-03-24,2030-06-30,52.858081471747695
Arsenal FC,Gabriel Magalhães,19/12/1997 (28),Brazil,left,Defender - Centre-Back,01/09/2020,30/06/2029,27,4,0,3,2,0,4,4,0,0,2.083',18,3,0,2,1,0,1,1,0,0,1.536',5,1,0,1,1,0,1,2,0,0,342',1,0,0,0,0,0,0,1,0,0,76',1.9,75000000.0,28.0,1997-12-19,2029-06-30,40.86727989487516
Arsenal FC,Piero Hincapié,09/01/2002 (24),Ecuador,left,Defender - Centre-Back,01/09/2025,30/06/2026,21,0,0,0,2,0,4,8,0,0,1.431',14,0,0,0,2,0,2,4,0,0,1.024',4,0,0,0,0,0,2,2,0,0,182',0,0,0,0,0,0,0,0,0,0,0,1.84,50000000.0,24.0,2002-01-09,2026-06-30,4.862023653088042
Arsenal FC,Cristhian Mosquera,27/06/2004 (21),Spain  Colombia,right,Defender - Centre-Back,24/07/2025,30/06/2030,18,0,0,0,1,0,8,3,0,0,988',10,0,0,0,1,0,6,2,0,0,430',6,0,0,0,0,0,2,1,0,0,378',0,0,0,0,0,0,0,0,0,0,0,1.91,35000000.0,21.0,2004-06-27,2030-06-30,52.858081471747695
Arsenal FC,Riccardo Calafiori,19/05/2002 (23),Italy,left,Defender - Left-Back,29/07/2024,30/06/2029,22,1,0,3,6,0,3,12,0,0,1.553',17,1,0,2,5,0,1,10,0,0,1.279',4,0,0,1,1,0,2,2,0,0,184',0,0,0,0,0,0,0,0,0,0,0,1.88,50000000.0,23.0,2002-05-19,2029-06-30,40.86727989487516
Arsenal FC,Myles Lewis-Skelly,26/09/2006 (19),England  Barbados,left,Defender - Left-Back,01/07/2024,30/06/2030,25,0,0,4,5,0,14,2,0,0,1.207',14,0,0,0,3,0,13,1,0,0,312',7,0,0,2,1,0,1,1,0,0,535',1,0,0,0,1,0,0,0,0,0,90',1.78,40000000.0,19.0,2006-09-26,2030-06-30,52.858081471747695
Arsenal FC,Jurriën Timber,17/06/2001 (24),Netherlands  Curacao,right,Defender - Right-Back,14/07/2023,30/06/2028,33,3,0,5,5,0,5,7,0,0,2.556',23,2,0,4,4,0,2,3,0,0,1.912',6,1,0,1,0,0,1,4,0,0,423',1,0,0,0,0,0,1,0,0,0,21',1.79,70000000.0,24.0,2001-06-17,2028-06-30,28.876478318002626
Arsenal FC,Ben White,08/10/1997 (28),England,right,Defender - Right-Back,30/07/2021,30/06/2028,18,1,0,2,2,0,6,7,0,0,1.001',7,0,0,1,0,0,2,2,0,0,411',7,0,0,1,1,0,4,2,0,0,290',1,0,0,0,1,0,0,1,0,0,69',1.86,30000000.0,28.0,1997-10-08,2028-06-30,28.876478318002626
Arsenal FC,Martín Zubimendi,02/02/1999 (26),Spain,right,Midfield - Defensive Midfield,06/07/2025,30/06/2030,32,5,0,3,7,0,2,8,0,0,2.622',24,4,0,1,4,0,1,7,0,0,2.001',6,0,0,2,3,0,0,1,0,0,523',1,0,0,0,0,0,1,0,0,0,8',1.81,75000000.0,26.0,1999-02-02,2030-06-30,52.858081471747695
Arsenal FC,Christian Nørgaard,10/03/1994 (31),Denmark,right,Midfield - Defensive Midfield,10/07/2025,30/06/2027,12,0,0,1,2,0,5,1,0,0,678',3,0,0,0,0,0,3,0,0,0,31',5,0,0,0,2,0,2,1,0,0,287',1,0,0,1,0,0,0,0,0,0,90',1.87,9000000.0,31.0,1994-03-10,2027-06-30,16.852825229960576
Arsenal FC,Declan Rice,14/01/1999 (27),England  Ireland,right,Midfield - Central Midfield,15/07/2023,30/06/2028,33,4,0,8,5,0,6,6,0,0,2.486',23,4,0,5,2,0,1,4,0,0,1.969',6,0,0,2,3,0,2,1,0,0,409',0,0,0,0,0,0,0,0,0,0,0,1.88,120000000.0,27.0,1999-01-14,2028-06-30,28.876478318002626
Arsenal FC,Mikel Merino,22/06/1996 (29),Spain,left,Midfield - Central Midfield,27/08/2024,30/06/2028,33,6,0,3,5,0,13,7,0,0,1.877',21,4,0,3,1,0,11,5,0,0,999',7,2,0,0,3,0,1,1,0,0,515',1,0,0,0,0,0,0,0,0,0,90',1.89,30000000.0,29.0,1996-06-22,2028-06-30,28.876478318002626
Arsenal FC,Martin Ødegaard,17/12/1998 (27),Norway,left,Midfield - Attacking Midfield,20/08/2021,30/06/2028,25,1,0,6,0,0,9,10,0,0,1.347',18,1,0,5,0,0,5,8,0,0,1.020',4,0,0,1,0,0,2,1,0,0,215',1,0,0,0,0,0,1,0,0,0,21',1.78,75000000.0,27.0,1998-12-17,2028-06-30,28.876478318002626
Arsenal FC,Eberechi Eze,29/06/1998 (27),England  Nigeria,right,Midfield - Attacking Midfield,23/08/2025,30/06/2029,31,5,0,4,1,0,9,17,0,0,1.896',19,4,0,2,1,0,7,10,0,0,1.064',7,0,0,2,0,0,2,4,0,0,421',1,0,0,0,0,0,0,0,0,0,90',1.78,65000000.0,27.0,1998-06-29,2029-06-30,40.86727989487516
Arsenal FC,Gabriel Martinelli,18/06/2001 (24),Brazil  Italy,right,Attack - Left Winger,02/07/2019,30/06/2027,29,10,0,2,2,0,15,12,0,0,1.207',18,1,0,1,2,0,11,7,0,0,580',7,6,0,1,0,0,3,2,0,0,382',1,3,0,0,0,0,0,1,0,0,82',1.78,45000000.0,24.0,2001-06-18,2027-06-30,16.852825229960576
Arsenal FC,Leandro Trossard,04/12/1994 (31),Belgium,right,Attack - Left Winger,20/01/2023,30/06/2027,29,7,0,7,2,0,10,17,0,0,1.739',20,5,0,4,1,0,6,12,0,0,1.338',5,1,0,3,0,0,1,4,0,0,287',0,0,0,0,0,0,0,0,0,0,0,1.72,20000000.0,31.0,1994-12-04,2027-06-30,16.852825229960576
Arsenal FC,Bukayo Saka,05/09/2001 (24),England  Nigeria,left,Attack - Right Winger,01/07/2019,30/06/2027,31,7,0,7,1,0,8,8,0,0,2.118',21,4,0,5,1,0,4,6,0,0,1.549',6,2,0,2,0,0,2,1,0,0,374',0,0,0,0,0,0,0,0,0,0,0,1.78,130000000.0,24.0,2001-09-05,2027-06-30,16.852825229960576
Arsenal FC,Noni Madueke,10/03/2002 (23),England  Nigeria,left,Attack - Right Winger,18/07/2025,30/06/2030,21,3,0,3,1,0,8,11,0,0,1.102',15,0,0,1,0,0,7,8,0,0,642',4,3,0,0,1,0,1,2,0,0,303',1,0,0,2,0,0,0,0,0,0,90',1.82,50000000.0,23.0,2002-03-10,2030-06-30,52.858081471747695
Arsenal FC,Max Dowman,31/12/2009 (16),England,left,Attack - Right Winger,01/07/2025,-,9,6,0,1,0,0,4,2,0,0,487',2,0,0,1,0,0,2,0,0,0,27',1,0,0,0,0,0,1,0,0,0,18',0,0,0,0,0,0,0,0,0,0,0,1.83,20000000.0,16.0,2009-12-31,,0.0
Arsenal FC,Viktor Gyökeres,04/06/1998 (27),Sweden  Hungary,right,Attack - Centre-Forward,26/07/2025,30/06/2030,30,11,0,2,3,0,6,17,0,0,1.955',22,6,0,0,3,0,4,12,0,0,1.462',6,4,0,1,0,0,1,4,0,0,392',0,0,0,0,0,0,0,0,0,0,0,1.89,70000000.0,27.0,1998-06-04,2030-06-30,52.858081471747695
Arsenal FC,Kai Havertz,11/06/1999 (26),Germany,left,Attack - Centre-Forward,01/07/2023,30/06/2028,5,1,0,1,0,0,3,2,0,0,165',2,0,0,0,0,0,1,1,0,0,91',1,1,0,1,0,0,0,1,0,0,45',1,0,0,0,0,0,1,0,0,0,21',1.93,55000000.0,26.0,1999-06-11,2028-06-30,28.876478318002626
Arsenal FC,Gabriel Jesus,03/04/1997 (28),Brazil,right,Attack - Centre-Forward,04/07/2022,30/06/2027,15,4,0,1,1,0,11,4,0,0,500',9,2,0,0,1,0,8,1,0,0,221',3,2,0,0,0,0,2,1,0,0,116',1,0,0,1,0,0,0,1,0,0,69',1.75,20000000.0,28.0,1997-04-03,2027-06-30,16.852825229960576
Chelsea FC,Robert Sánchez,18/11/1997 (28),Spain  England,right,Goalkeeper,05/08/2023,30/06/2030,30,0,0,0,2,1,1,0,13,34,2.570',22,0,0,0,2,1,0,0,22,10,1.895',7,0,0,0,0,0,1,0,3,9,585',0,0,0,0,0,0,0,0,0,0,0,1.97,22000000.0,28.0,1997-11-18,2030-06-30,52.858081471747695
Chelsea FC,Filip Jørgensen,16/04/2002 (23),Denmark  Sweden,right,Goalkeeper,30/07/2024,30/06/2031,8,0,0,0,1,0,1,1,1,10,669',2,0,0,0,0,0,1,0,3,0,174',2,0,0,0,0,0,0,1,1,1,135',1,0,0,0,0,0,0,0,0,1,90',1.92,15000000.0,23.0,2002-04-16,2031-06-30,64.84888304862024
Chelsea FC,Gabriel Slonina,15/05/2004 (21),United States  Poland,right,Goalkeeper,02/08/2022,30/06/2028,3,0,0,0,1,0,0,0,1,4,270',0,0,0,0,0,0,0,0,0,0,0,0,0,0,0,0,0,0,0,0,0,0,0,0,0,0,0,0,0,0,0,0,0,1.93,3500000.0,21.0,2004-05-15,2028-06-30,28.876478318002626
Chelsea FC,Levi Colwill,26/02/2003 (22),England,left,Defender - Centre-Back,01/07/2022,30/06/2029,178,6,2,8,27,0,21,21,0,0,14.364',75,3,0,4,12,0,7,8,0,0,6.168',0,0,0,0,0,0,0,0,0,0,0,4,0,0,0,0,0,2,1,0,0,232',1.87,50000000.0,22.0,2003-02-26,2029-06-30,40.86727989487516
Chelsea FC,Trevoh Chalobah,05/07/1999 (26),England  Sierra Leone,right,Defender - Centre-Back,01/07/2021,30/06/2028,31,3,1,0,4,1,3,2,0,0,2.499',22,3,0,0,3,1,0,1,0,0,1.922',6,0,1,0,1,0,2,1,0,0,391',0,0,0,0,0,0,0,0,0,0,0,1.92,35000000.0,26.0,1999-07-05,2028-06-30,28.876478318002626
Chelsea FC,Wesley Fofana,17/12/2000 (25),France  Cote d'Ivoire,right,Defender - Centre-Back,31/08/2022,30/06/2029,20,0,0,1,3,0,5,5,0,0,1.369',12,0,0,0,2,0,3,3,0,0,808',5,0,0,1,1,0,1,1,0,0,391',1,0,0,0,0,0,1,0,0,0,5',1.88,28000000.0,25.0,2000-12-17,2029-06-30,40.86727989487516
Chelsea FC,Tosin Adarabioyo,24/09/1997 (28),England  Nigeria,right,Defender - Centre-Back,01/07/2024,30/06/2028,19,1,0,0,3,0,6,2,0,0,1.223',11,0,0,0,2,0,4,1,0,0,705',4,0,0,0,1,0,1,1,0,0,239',1,1,0,0,0,0,0,0,0,0,90',1.97,20000000.0,28.0,1997-09-24,2028-06-30,28.876478318002626
Chelsea FC,Benoît Badiashile,26/03/2001 (24),France  DR Congo,left,Defender - Centre-Back,05/01/2023,30/06/2030,14,0,0,0,4,0,4,3,0,0,905',7,0,0,0,2,0,2,2,0,0,426',4,0,0,0,0,0,1,1,0,0,262',1,0,0,0,1,0,0,0,0,0,90',1.94,18000000.0,24.0,2001-03-26,2030-06-30,52.858081471747695
Chelsea FC,Axel Disasi,11/03/1998 (27),France  DR Congo,right,Defender - Centre-Back,04/08/2023,30/06/2029,3,0,0,0,0,0,0,2,0,0,223',0,0,0,0,0,0,0,0,0,0,0,0,0,0,0,0,0,0,0,0,0,0,0,0,0,0,0,0,0,0,0,0,0,1.91,15000000.0,27.0,1998-03-11,2029-06-30,40.86727989487516
Chelsea FC,Aarón Anselmino,29/04/2005 (20),Argentina,right,Defender - Centre-Back,08/08/2024,30/06/2031,10,1,0,1,1,0,3,3,0,0,585',0,0,0,0,0,0,0,0,0,0,0,3,0,0,1,0,0,1,1,0,0,172',0,0,0,0,0,0,0,0,0,0,0,1.86,12000000.0,20.0,2005-04-29,2031-06-30,64.84888304862024
Chelsea FC,Marc Cucurella,22/07/1998 (27),Spain,left,Defender - Left-Back,05/08/2022,30/06/2028,31,0,0,2,7,1,4,4,0,0,2.400',21,0,0,2,4,1,1,3,0,0,1.709',7,0,0,0,0,0,1,0,0,0,560',0,0,0,0,0,0,0,0,0,0,0,1.73,50000000.0,27.0,1998-07-22,2028-06-30,28.876478318002626
Chelsea FC,Jorrel Hato,07/03/2006 (19),Netherlands  Curacao,left,Defender - Left-Back,03/08/2025,30/06/2032,16,1,0,1,2,0,7,4,0,0,891',8,0,0,0,2,0,6,2,0,0,271',3,0,0,0,0,0,0,1,0,0,250',1,1,0,0,0,0,0,1,0,0,85',1.82,35000000.0,19.0,2006-03-07,2032-06-30,76.87253613666228
Chelsea FC,Caleb Wiley,22/12/2004 (21),United States,left,Defender - Left-Back,22/07/2024,30/06/2030,5,0,0,0,0,0,2,3,0,0,222',0,0,0,0,0,0,0,0,0,0,0,0,0,0,0,0,0,0,0,0,0,0,0,0,0,0,0,0,0,0,0,0,0,1.8,8000000.0,21.0,2004-12-22,2030-06-30,52.858081471747695
Chelsea FC,Reece James,08/12/1999 (26),England,right,Defender - Right-Back,01/07/2019,30/06/2028,29,2,0,6,5,0,7,7,0,0,2.002',22,2,0,4,4,0,6,4,0,0,1.528',7,0,0,2,1,0,1,3,0,0,474',0,0,0,0,0,0,0,0,0,0,0,1.8,50000000.0,26.0,1999-12-08,2028-06-30,28.876478318002626
Chelsea FC,Malo Gusto,19/05/2003 (22),France  Martinique,right,Defender - Right-Back,29/01/2023,30/06/2030,29,2,0,3,2,0,9,9,0,0,1.800',20,2,0,2,1,0,7,5,0,0,1.238',6,0,0,1,1,0,1,3,0,0,388',0,0,0,0,0,0,0,0,0,0,0,1.78,35000000.0,22.0,2003-05-19,2030-06-30,52.858081471747695
Chelsea FC,Josh Acheampong,05/05/2006 (19),England  Ghana,right,Defender - Right-Back,18/12/2024,30/06/2029,17,1,0,0,0,0,6,7,0,0,942',9,1,0,0,0,0,3,5,0,0,477',4,0,0,0,0,0,3,0,0,0,148',1,0,0,0,0,0,0,0,0,0,90',1.9,20000000.0,19.0,2006-05-05,2029-06-30,40.86727989487516
Chelsea FC,Moisés Caicedo,02/11/2001 (24),Ecuador,right,Midfield - Defensive Midfield,14/08/2023,30/06/2031,29,5,0,1,9,1,3,2,0,0,2.362',18,3,0,1,6,1,1,1,0,0,1.506',8,2,0,0,1,0,1,1,0,0,671',1,0,0,0,0,0,0,0,0,0,90',1.78,110000000.0,24.0,2001-11-02,2031-06-30,64.84888304862024
Chelsea FC,Roméo Lavia,06/01/2004 (22),Belgium,right,Midfield - Defensive Midfield,18/08/2023,30/06/2030,7,0,0,0,0,0,3,4,0,0,240',4,0,0,0,0,0,3,1,0,0,105',2,0,0,0,0,0,0,2,0,0,74',0,0,0,0,0,0,0,0,0,0,0,1.81,30000000.0,22.0,2004-01-06,2030-06-30,52.858081471747695
Chelsea FC,Dário Essugo,14/03/2005 (20),Portugal  Angola,right,Midfield - Defensive Midfield,10/06/2025,30/06/2033,0,0,0,0,0,0,0,0,0,0,0,0,0,0,0,0,0,0,0,0,0,0,0,0,0,0,0,0,0,0,0,0,0,0,0,0,0,0,0,0,0,0,0,0,1.78,20000000.0,20.0,2005-03-14,2033-06-30,88.86333771353482
Chelsea FC,Enzo Fernández,17/01/2001 (25),Argentina,right,Midfield - Central Midfield,31/01/2023,30/06/2032,34,10,0,4,8,0,4,8,0,0,2.686',22,7,0,2,5,0,1,4,0,0,1.878',8,2,0,1,2,0,1,3,0,0,598',1,1,0,1,0,0,1,0,0,0,21',1.78,85000000.0,25.0,2001-01-17,2032-06-30,76.87253613666228
Chelsea FC,Andrey Santos,03/05/2004 (21),Brazil,right,Midfield - Central Midfield,01/01/2023,30/06/2030,27,1,0,4,7,0,14,6,0,0,1.303',17,0,0,0,4,0,11,4,0,0,637',5,0,0,2,2,0,3,2,0,0,216',1,0,0,0,0,0,0,0,0,0,90',1.8,40000000.0,21.0,2004-05-03,2030-06-30,52.858081471747695
Chelsea FC,Cole Palmer,06/05/2002 (23),England  St. Kitts & Nevis,left,Midfield - Attacking Midfield,01/09/2023,30/06/2033,14,5,0,2,2,0,3,7,0,0,894',12,4,0,0,2,0,2,7,0,0,759',2,1,0,2,0,0,1,0,0,0,135',0,0,0,0,0,0,0,0,0,0,0,1.85,120000000.0,23.0,2002-05-06,2033-06-30,88.86333771353482
Chelsea FC,Alejandro Garnacho,01/07/2004 (21),Argentina  Spain,right,Attack - Left Winger,30/08/2025,30/06/2032,25,6,0,3,1,0,9,14,0,0,1.345',14,1,0,3,1,0,3,9,0,0,822',7,1,0,0,0,0,4,3,0,0,297',1,0,0,0,0,0,0,1,0,0,85',1.8,45000000.0,21.0,2004-07-01,2032-06-30,76.87253613666228
Chelsea FC,Jamie Gittens,08/08/2004 (21),England  Barbados,right,Attack - Left Winger,05/07/2025,30/06/2032,26,1,0,5,1,0,15,8,0,0,1.076',15,0,0,2,0,0,11,3,0,0,464',7,0,0,1,1,0,4,2,0,0,320',1,0,0,0,0,0,0,1,0,0,66',1.78,40000000.0,21.0,2004-08-08,2032-06-30,76.87253613666228
Chelsea FC,Tyrique George,04/02/2006 (19),England  Nigeria,right,Attack - Left Winger,18/12/2024,30/06/2027,11,3,0,1,3,0,6,6,0,0,492',4,0,0,0,2,0,4,1,0,0,143',4,1,0,0,0,0,2,2,0,0,158',0,0,0,0,0,0,0,0,0,0,0,1.81,22000000.0,19.0,2006-02-04,2027-06-30,16.852825229960576
Chelsea FC,Mykhaylo Mudryk,05/01/2001 (25),Ukraine,right,Attack - Left Winger,15/01/2023,30/06/2031,150,22,0,30,19,1,58,67,0,0,7.982',53,5,0,6,6,0,27,23,0,0,2.380',14,3,0,2,4,0,6,5,0,0,791',5,1,0,0,0,0,2,3,0,0,253',1.75,0.0,25.0,2001-01-05,2031-06-30,64.84888304862024
Chelsea FC,Estêvão,24/04/2007 (18),Brazil,left,Attack - Right Winger,14/07/2025,30/06/2033,29,6,0,3,6,0,14,12,0,0,1.312',18,2,0,2,3,0,9,9,0,0,679',7,3,0,0,1,0,3,2,0,0,427',1,0,0,1,0,0,1,0,0,0,24',1.76,80000000.0,18.0,2007-04-24,2033-06-30,88.86333771353482
Chelsea FC,Pedro Neto,09/03/2000 (25),Portugal,left,Attack - Right Winger,11/08/2024,30/06/2031,34,7,0,4,4,0,6,13,0,0,2.398',23,5,0,3,2,0,2,9,0,0,1.811',6,0,0,0,1,0,0,4,0,0,434',1,1,0,0,0,0,1,0,0,0,5',1.74,60000000.0,25.0,2000-03-09,2031-06-30,64.84888304862024
Chelsea FC,João Pedro,26/09/2001 (24),Brazil,right,Attack - Centre-Forward,02/07/2025,30/06/2033,31,11,0,4,2,0,6,14,0,0,2.206',23,8,0,3,2,0,3,12,0,0,1.690',6,3,0,0,0,0,2,1,0,0,390',0,0,0,0,0,0,0,0,0,0,0,1.82,65000000.0,24.0,2001-09-26,2033-06-30,88.86333771353482
Chelsea FC,Liam Delap,08/02/2003 (22),England  Ireland,right,Attack - Centre-Forward,04/06/2025,30/06/2031,19,2,0,1,2,0,10,8,0,0,791',14,1,0,1,2,0,6,7,0,0,599',3,1,0,0,0,0,2,1,0,0,146',1,0,0,0,0,0,1,0,0,0,21',1.86,35000000.0,22.0,2003-02-08,2031-06-30,64.84888304862024
Chelsea FC,Marc Guiu,04/01/2006 (20),Spain,right,Attack - Centre-Forward,01/07/2024,30/06/2029,14,3,0,2,1,0,8,5,0,0,550',9,0,0,1,1,0,8,1,0,0,248',1,1,0,0,0,0,0,1,0,0,45',1,1,0,1,0,0,0,1,0,0,69',1.87,12000000.0,20.0,2006-01-04,2029-06-30,40.86727989487516
Chelsea FC,David Datro Fofana,22/12/2002 (23),Cote d'Ivoire,right,Attack - Centre-Forward,01/01/2023,30/06/2029,15,8,0,0,0,0,4,4,0,0,1.062',0,0,0,0,0,0,0,0,0,0,0,0,0,0,0,0,0,0,0,0,0,0,0,0,0,0,0,0,0,0,0,0,0,1.82,5000000.0,23.0,2002-12-22,2029-06-30,40.86727989487516
Liverpool FC,Giorgi Mamardashvili,29/09/2000 (25),Georgia,left,Goalkeeper,27/08/2024,30/06/2031,11,0,0,0,0,0,1,0,3,17,934',5,0,0,0,0,0,0,0,10,1,450',4,0,0,0,0,0,1,0,2,5,304',1,0,0,0,0,0,0,0,0,1,90',1.97,28000000.0,25.0,2000-09-29,2031-06-30,64.84888304862024
Liverpool FC,Alisson,02/10/1992 (33),Brazil,right,Goalkeeper,19/07/2018,30/06/2027,24,0,0,0,0,0,0,1,9,27,2.126',18,0,0,0,0,0,0,0,22,6,1.620',5,0,0,0,0,0,0,1,3,3,416',0,0,0,0,0,0,0,0,0,0,0,1.93,17000000.0,33.0,1992-10-02,2027-06-30,16.852825229960576
Liverpool FC,Freddie Woodman,04/03/1997 (28),England,right,Goalkeeper,01/07/2025,30/06/2026,1,0,0,0,0,0,0,0,0,3,90',0,0,0,0,0,0,0,0,0,0,0,0,0,0,0,0,0,0,0,0,0,0,0,0,0,0,0,0,0,0,0,0,0,1.88,3000000.0,28.0,1997-03-04,2026-06-30,4.862023653088042
Liverpool FC,Ibrahima Konaté,25/05/1999 (26),France  Mali,right,Defender - Centre-Back,01/07/2021,30/06/2026,30,1,0,0,6,0,1,7,0,0,2.512',22,0,0,0,5,0,0,5,0,0,1.881',6,1,0,0,0,0,0,2,0,0,511',1,0,0,0,0,0,1,0,0,0,30',1.94,50000000.0,26.0,1999-05-25,2026-06-30,4.862023653088042
Liverpool FC,Giovanni Leoni,21/12/2006 (19),Italy,right,Defender - Centre-Back,15/08/2025,30/06/2031,1,0,0,0,0,0,0,1,0,0,81',0,0,0,0,0,0,0,0,0,0,0,0,0,0,0,0,0,0,0,0,0,0,0,0,0,0,0,0,0,0,0,0,0,1.96,25000000.0,19.0,2006-12-21,2031-06-30,64.84888304862024
Liverpool FC,Virgil van Dijk,08/07/1991 (34),Netherlands  Suriname,right,Defender - Centre-Back,01/01/2018,30/06/2027,33,3,0,3,4,0,0,0,0,0,2.970',23,1,0,0,3,0,0,0,0,0,2.070',8,2,0,3,1,0,0,0,0,0,720',1,0,0,0,0,0,0,0,0,0,90',1.95,18000000.0,34.0,1991-07-08,2027-06-30,16.852825229960576
Liverpool FC,Joe Gomez,23/05/1997 (28),England  The Gambia,right,Defender - Centre-Back,01/07/2015,30/06/2027,17,0,0,2,3,0,8,5,0,0,696',11,0,0,2,2,0,7,3,0,0,283',3,0,0,0,0,0,1,1,0,0,173',1,0,0,0,1,0,0,1,0,0,60',1.88,15000000.0,28.0,1997-05-23,2027-06-30,16.852825229960576
Liverpool FC,Rhys Williams,03/02/2001 (24),England  Jamaica,right,Defender - Centre-Back,01/07/2020,30/06/2026,4,0,0,0,1,0,0,1,0,0,333',0,0,0,0,0,0,0,0,0,0,0,0,0,0,0,0,0,0,0,0,0,0,0,0,0,0,0,0,0,0,0,0,0,1.95,500000.0,24.0,2001-02-03,2026-06-30,4.862023653088042
Liverpool FC,Milos Kerkez,07/11/2003 (22),Hungary  Serbia,left,Defender - Left-Back,01/07/2025,30/06/2030,30,1,0,0,4,0,6,9,0,0,2.001',22,1,0,0,4,0,3,8,0,0,1.542',5,0,0,0,0,0,2,0,0,0,276',0,0,0,0,0,0,0,0,0,0,0,1.8,40000000.0,22.0,2003-11-07,2030-06-30,52.858081471747695
Liverpool FC,Andrew Robertson,11/03/1994 (31),Scotland,left,Defender - Left-Back,21/07/2017,30/06/2026,23,1,0,1,1,0,11,6,0,0,1.238',14,0,0,0,0,0,10,3,0,0,541',5,1,0,1,0,0,0,2,0,0,444',1,0,0,0,0,0,0,0,0,0,90',1.78,12000000.0,31.0,1994-03-11,2026-06-30,4.862023653088042
Liverpool FC,Jeremie Frimpong,10/12/2000 (25),Netherlands  Ghana,right,Defender - Right-Back,01/07/2025,30/06/2030,19,2,0,1,0,0,5,9,0,0,1.014',11,0,0,1,0,0,5,4,0,0,541',5,0,0,0,0,0,0,4,0,0,233',1,1,0,0,0,0,0,1,0,0,60',1.72,38000000.0,25.0,2000-12-10,2030-06-30,52.858081471747695
Liverpool FC,Conor Bradley,09/07/2003 (22),Northern Ireland,right,Defender - Right-Back,01/07/2023,30/06/2029,21,0,0,2,7,0,8,9,0,0,1.209',15,0,0,2,5,0,3,9,0,0,933',5,0,0,0,2,0,4,0,0,0,243',0,0,0,0,0,0,0,0,0,0,0,1.81,30000000.0,22.0,2003-07-09,2029-06-30,40.86727989487516
Liverpool FC,Ryan Gravenberch,16/05/2002 (23),Netherlands  Suriname,right,Midfield - Defensive Midfield,01/09/2023,30/06/2028,29,4,0,4,5,0,1,3,0,0,2.469',21,4,0,2,4,0,0,2,0,0,1.850',7,0,0,2,1,0,0,1,0,0,602',1,0,0,0,0,0,1,0,0,0,17',1.9,90000000.0,23.0,2002-05-16,2028-06-30,28.876478318002626
Liverpool FC,Stefan Bajcetic,22/10/2004 (21),Spain  Serbia,right,Midfield - Defensive Midfield,01/07/2022,30/06/2027,91,5,0,3,17,0,28,39,0,0,5.544',12,1,0,0,2,0,6,6,0,0,554',10,0,0,0,0,0,8,2,0,0,310',2,0,0,0,1,0,0,2,0,0,159',1.85,7000000.0,21.0,2004-10-22,2027-06-30,16.852825229960576
Liverpool FC,Wataru Endo,09/02/1993 (32),Japan,right,Midfield - Defensive Midfield,18/08/2023,30/06/2027,10,0,0,1,1,0,8,0,0,0,383',6,0,0,1,1,0,6,0,0,0,98',1,0,0,0,0,0,1,0,0,0,86',0,0,0,0,0,0,0,0,0,0,0,1.78,5000000.0,32.0,1993-02-09,2027-06-30,16.852825229960576
Liverpool FC,Alexis Mac Allister,24/12/1998 (27),Argentina  Italy,right,Midfield - Central Midfield,01/07/2023,30/06/2028,33,3,0,4,4,0,8,13,0,0,2.148',22,0,0,2,3,0,4,10,0,0,1.465',8,3,0,0,1,0,3,1,0,0,509',1,0,0,2,0,0,0,1,0,0,88',1.76,85000000.0,27.0,1998-12-24,2028-06-30,28.876478318002626
Liverpool FC,Curtis Jones,30/01/2001 (25),England,right,Midfield - Central Midfield,01/07/2020,30/06/2027,29,0,0,1,3,0,12,8,0,0,1.686',20,0,0,1,1,0,10,6,0,0,1.086',6,0,0,0,2,0,2,0,0,0,382',1,0,0,0,0,0,0,0,0,0,90',1.85,40000000.0,25.0,2001-01-30,2027-06-30,16.852825229960576
Liverpool FC,Trey Nyoni,30/06/2007 (18),England  Zimbabwe,right,Midfield - Central Midfield,01/07/2025,30/06/2026,12,0,0,0,0,0,4,0,0,0,747',2,0,0,0,0,0,2,0,0,0,2',1,0,0,0,0,0,1,0,0,0,23',1,0,0,0,0,0,1,0,0,0,2',1.8,6000000.0,18.0,2007-06-30,2026-06-30,4.862023653088042
Liverpool FC,Florian Wirtz,03/05/2003 (22),Germany,right,Midfield - Attacking Midfield,01/07/2025,30/06/2030,31,5,0,7,2,0,6,19,0,0,2.220',22,3,0,2,1,0,4,14,0,0,1.596',7,1,0,3,0,0,1,4,0,0,510',1,1,0,1,0,0,1,0,0,0,30',1.77,110000000.0,22.0,2003-05-03,2030-06-30,52.858081471747695
Liverpool FC,Dominik Szoboszlai,25/10/2000 (25),Hungary,right,Midfield - Attacking Midfield,02/07/2023,30/06/2028,32,8,0,7,5,0,0,2,0,0,2.858',22,3,0,2,5,0,0,1,0,0,1.973',8,4,0,4,0,0,0,1,0,0,705',1,1,0,0,0,0,0,0,0,0,90',1.87,85000000.0,25.0,2000-10-25,2028-06-30,28.876478318002626
Liverpool FC,Cody Gakpo,07/05/1999 (26),Netherlands  Togo,right,Attack - Left Winger,01/01/2023,30/06/2030,30,7,0,4,1,0,6,12,0,0,2.059',21,5,0,3,1,0,4,8,0,0,1.499',7,2,0,1,0,0,2,4,0,0,380',1,0,0,0,0,0,0,0,0,0,90',1.93,70000000.0,26.0,1999-05-07,2030-06-30,52.858081471747695
Liverpool FC,Rio Ngumoha,29/08/2008 (17),England  Nigeria,right,Attack - Left Winger,01/07/2025,30/06/2028,14,1,0,0,0,0,10,4,0,0,394',8,1,0,0,0,0,8,0,0,0,76',2,0,0,0,0,0,2,0,0,0,39',1,0,0,0,0,0,0,1,0,0,73',1.7,15000000.0,17.0,2008-08-29,2028-06-30,28.876478318002626
Liverpool FC,Mohamed Salah,15/06/1992 (33),Egypt,left,Attack - Right Winger,01/07/2017,30/06/2027,23,6,0,5,2,0,4,2,0,0,1.858',15,4,0,4,1,0,2,2,0,0,1.274',7,2,0,1,0,0,2,0,0,0,494',0,0,0,0,0,0,0,0,0,0,0,1.75,30000000.0,33.0,1992-06-15,2027-06-30,16.852825229960576
Liverpool FC,Federico Chiesa,25/10/1997 (28),Italy,right,Attack - Right Winger,29/08/2024,30/06/2028,23,3,0,3,3,0,19,2,0,0,548',16,2,0,1,2,0,15,1,0,0,231',4,1,0,0,0,0,4,0,0,0,77',1,0,0,0,0,0,0,1,0,0,60',1.75,18000000.0,28.0,1997-10-25,2028-06-30,28.876478318002626
Liverpool FC,Alexander Isak,21/09/1999 (26),Sweden  Eritrea,right,Attack - Centre-Forward,01/09/2025,30/06/2031,16,3,0,1,0,0,6,11,0,0,781',10,2,0,1,0,0,4,7,0,0,508',5,0,0,0,0,0,2,3,0,0,228',0,0,0,0,0,0,0,0,0,0,0,1.92,120000000.0,26.0,1999-09-21,2031-06-30,64.84888304862024
Liverpool FC,Hugo Ekitiké,20/06/2002 (23),France  Cameroon,right,Attack - Centre-Forward,23/07/2025,30/06/2031,31,13,0,4,1,0,9,18,0,0,1.951',20,8,0,2,0,0,6,11,0,0,1.259',8,2,0,1,1,0,1,6,0,0,550',1,1,0,1,0,0,1,0,0,0,30',1.9,85000000.0,23.0,2002-06-20,2031-06-30,64.84888304862024
Tottenham Hotspur,Guglielmo Vicario,07/10/1996 (29),Italy,right,Goalkeeper,01/07/2023,30/06/2028,33,0,0,0,2,0,0,0,13,42,2.970',23,0,0,0,1,0,0,0,31,7,2.070',8,0,0,0,1,0,0,0,6,7,720',1,0,0,0,0,0,0,0,0,2,90',1.94,30000000.0,29.0,1996-10-07,2028-06-30,28.876478318002626
Tottenham Hotspur,Antonín Kinský,13/03/2003 (22),Czech Republic,right,Goalkeeper,05/01/2025,30/06/2029,2,0,0,0,0,0,0,0,1,2,180',0,0,0,0,0,0,0,0,0,0,0,0,0,0,0,0,0,0,0,0,0,0,0,0,0,0,0,0,0,0,0,0,0,1.9,13000000.0,22.0,2003-03-13,2029-06-30,40.86727989487516
Tottenham Hotspur,Brandon Austin,08/01/1999 (27),England  United States,right,Goalkeeper,01/08/2021,30/06/2029,0,0,0,0,0,0,0,0,0,0,0,0,0,0,0,0,0,0,0,0,0,0,0,0,0,0,0,0,0,0,0,0,0,0,0,0,0,0,0,0,0,0,0,0,1.88,500000.0,27.0,1999-01-08,2029-06-30,40.86727989487516
Tottenham Hotspur,Micky van de Ven,19/04/2001 (24),Netherlands,left,Defender - Centre-Back,08/08/2023,30/06/2029,30,7,0,1,9,0,0,1,0,0,2.690',22,4,0,1,6,0,0,1,0,0,1.970',6,2,0,0,3,0,0,0,0,0,540',1,0,0,0,0,0,0,0,0,0,90',1.93,65000000.0,24.0,2001-04-19,2029-06-30,40.86727989487516
Tottenham Hotspur,Cristian Romero,27/04/1998 (27),Argentina,right,Defender - Centre-Back,30/08/2022,30/06/2029,26,6,0,4,8,0,1,4,0,0,2.252',19,4,0,1,8,0,1,3,0,0,1.639',6,1,0,3,0,0,0,1,0,0,523',0,0,0,0,0,0,0,0,0,0,0,1.85,60000000.0,27.0,1998-04-27,2029-06-30,40.86727989487516
Tottenham Hotspur,Radu Drăgușin,03/02/2002 (23),Romania,right,Defender - Centre-Back,11/01/2024,30/06/2030,2,0,0,0,0,0,2,0,0,0,6',2,0,0,0,0,0,2,0,0,0,6',0,0,0,0,0,0,0,0,0,0,0,0,0,0,0,0,0,0,0,0,0,0,1.91,22000000.0,23.0,2002-02-03,2030-06-30,52.858081471747695
Tottenham Hotspur,Kevin Danso,19/09/1998 (27),Austria,right,Defender - Centre-Back,01/07/2025,30/06/2030,23,0,0,0,5,0,7,3,0,0,1.398',13,0,0,0,4,0,5,3,0,0,660',6,0,0,0,0,0,2,0,0,0,378',1,0,0,0,0,0,0,0,0,0,90',1.9,22000000.0,27.0,1998-09-19,2030-06-30,52.858081471747695
Tottenham Hotspur,Ben Davies,24/04/1993 (32),Wales,left,Defender - Centre-Back,23/07/2014,30/06/2026,5,1,0,0,1,0,2,2,0,0,250',3,1,0,0,1,0,1,2,0,0,138',1,0,0,0,0,0,1,0,0,0,22',1,0,0,0,0,0,0,0,0,0,90',1.81,5000000.0,32.0,1993-04-24,2026-06-30,4.862023653088042
Tottenham Hotspur,Destiny Udogie,28/11/2002 (23),Italy  Nigeria,left,Defender - Left-Back,16/08/2022,30/06/2030,18,0,0,1,1,0,9,4,0,0,955',11,0,0,1,1,0,5,2,0,0,652',6,0,0,0,0,0,3,2,0,0,287',0,0,0,0,0,0,0,0,0,0,0,1.88,40000000.0,23.0,2002-11-28,2030-06-30,52.858081471747695
Tottenham Hotspur,Djed Spence,09/08/2000 (25),England  Jamaica,right,Defender - Left-Back,19/07/2022,30/06/2029,32,0,0,0,3,0,6,9,0,0,2.306',20,0,0,0,3,0,3,5,0,0,1.511',8,0,0,0,0,0,2,3,0,0,533',1,0,0,0,0,0,1,0,0,0,7',1.84,32000000.0,25.0,2000-08-09,2029-06-30,40.86727989487516
Tottenham Hotspur,Souza,16/06/2006 (19),Brazil,left,Defender - Left-Back,22/01/2026,30/06/2031,56,2,0,6,7,0,22,21,0,0,3.140',0,0,0,0,0,0,0,0,0,0,0,0,0,0,0,0,0,0,0,0,0,0,0,0,0,0,0,0,0,0,0,0,0,1.83,5000000.0,19.0,2006-06-16,2031-06-30,64.84888304862024
Tottenham Hotspur,Pedro Porro,13/09/1999 (26),Spain,right,Defender - Right-Back,01/07/2023,30/06/2028,34,0,0,5,8,0,2,7,0,0,2.785',23,0,0,2,5,0,2,5,0,0,1.824',7,0,0,2,1,0,0,1,0,0,608',1,0,0,0,1,0,0,1,0,0,83',1.73,40000000.0,26.0,1999-09-13,2028-06-30,28.876478318002626
Tottenham Hotspur,João Palhinha,09/07/1995 (30),Portugal,right,Midfield - Defensive Midfield,03/08/2025,30/06/2026,31,5,0,3,9,0,10,6,0,0,2.000',20,3,0,2,5,0,6,5,0,0,1.303',7,1,0,1,2,0,4,0,0,0,355',1,0,0,0,1,0,0,0,0,0,90',1.9,25000000.0,30.0,1995-07-09,2026-06-30,4.862023653088042
Tottenham Hotspur,Yves Bissouma,30/08/1996 (29),Mali  Cote d'Ivoire,right,Midfield - Defensive Midfield,01/07/2022,30/06/2026,2,0,0,0,0,0,1,1,0,0,123',2,0,0,0,0,0,1,1,0,0,123',0,0,0,0,0,0,0,0,0,0,0,0,0,0,0,0,0,0,0,0,0,0,1.82,15000000.0,29.0,1996-08-30,2026-06-30,4.862023653088042
Tottenham Hotspur,Lucas Bergvall,02/02/2006 (19),Sweden,right,Midfield - Central Midfield,01/07/2024,30/06/2031,26,1,0,4,3,0,10,15,0,0,1.291',17,1,0,2,2,0,7,10,0,0,809',6,0,0,1,1,0,1,5,0,0,362',0,0,0,0,0,0,0,0,0,0,0,1.87,40000000.0,19.0,2006-02-02,2031-06-30,64.84888304862024
Tottenham Hotspur,Archie Gray,12/03/2006 (19),England  Scotland,right,Midfield - Central Midfield,02/07/2024,30/06/2030,22,1,0,0,6,0,6,9,0,0,1.274',13,1,0,0,4,0,4,7,0,0,663',6,0,0,0,1,0,1,2,0,0,413',1,0,0,0,1,0,0,0,0,0,90',1.87,35000000.0,19.0,2006-03-12,2030-06-30,52.858081471747695
Tottenham Hotspur,Conor Gallagher,06/02/2000 (25),England,right,Midfield - Central Midfield,14/01/2026,30/06/2031,29,3,0,1,2,0,18,9,0,0,1.240',2,0,0,0,0,0,0,1,0,0,175',6,1,0,0,0,0,3,2,0,0,289',0,0,0,0,0,0,0,0,0,0,0,1.82,35000000.0,25.0,2000-02-06,2031-06-30,64.84888304862024
Tottenham Hotspur,Pape Matar Sarr,14/09/2002 (23),Senegal,right,Midfield - Central Midfield,27/08/2021,30/06/2030,23,2,0,2,0,0,9,6,0,0,1.348',14,2,0,2,0,0,7,2,0,0,705',7,0,0,0,0,0,2,3,0,0,463',0,0,0,0,0,0,0,0,0,0,0,1.84,35000000.0,23.0,2002-09-14,2030-06-30,52.858081471747695
Tottenham Hotspur,Rodrigo Bentancur,25/06/1997 (28),Uruguay,right,Midfield - Central Midfield,31/01/2022,-,28,1,0,1,5,0,3,11,0,0,2.072',20,1,0,1,5,0,3,8,0,0,1.415',5,0,0,0,0,0,0,2,0,0,412',0,0,0,0,0,0,0,0,0,0,0,1.87,27000000.0,28.0,1997-06-25,,0.0
Tottenham Hotspur,Xavi Simons,21/04/2003 (22),Netherlands  Suriname,right,Midfield - Attacking Midfield,29/08/2025,30/06/2030,30,3,0,5,4,1,8,10,0,0,2.003',17,1,0,3,2,1,5,7,0,0,1.108',8,1,0,1,1,0,3,2,0,0,474',1,0,0,0,0,0,0,0,0,0,90',1.79,60000000.0,22.0,2003-04-21,2030-06-30,52.858081471747695
Tottenham Hotspur,Dejan Kulusevski,25/04/2000 (25),Sweden  North Macedonia,left,Midfield - Attacking Midfield,01/07/2023,30/06/2028,343,78,0,75,40,0,91,110,0,0,23.540',116,22,0,22,15,0,21,44,0,0,8.503',15,1,0,1,2,0,10,5,0,0,545',8,1,0,2,0,0,3,1,0,0,535',1.86,45000000.0,25.0,2000-04-25,2028-06-30,28.876478318002626
Tottenham Hotspur,James Maddison,23/11/1996 (29),England,right,Midfield - Attacking Midfield,01/07/2023,30/06/2028,393,97,0,89,58,0,85,155,0,0,27.561',222,56,0,51,35,0,31,101,0,0,16.507',0,0,0,0,0,0,0,0,0,0,0,15,2,0,3,3,0,6,3,0,0,953',1.75,30000000.0,29.0,1996-11-23,2028-06-30,28.876478318002626
Tottenham Hotspur,Wilson Odobert,28/11/2004 (21),France  Martinique,right,Attack - Left Winger,16/08/2024,30/06/2029,30,2,0,5,0,0,14,13,0,0,1.520',21,0,0,2,0,0,13,7,0,0,892',7,1,0,2,0,0,1,4,0,0,484',1,1,0,0,0,0,0,1,0,0,83',1.82,22000000.0,21.0,2004-11-28,2029-06-30,40.86727989487516
Tottenham Hotspur,Mohammed Kudus,02/08/2000 (25),Ghana,left,Attack - Right Winger,10/07/2025,30/06/2031,26,3,0,6,4,0,3,14,0,0,1.921',19,2,0,6,3,0,0,11,0,0,1.546',5,1,0,0,0,0,2,2,0,0,271',0,0,0,0,0,0,0,0,0,0,0,1.77,55000000.0,25.0,2000-08-02,2031-06-30,64.84888304862024
Tottenham Hotspur,Dominic Solanke,14/09/1997 (28),England  Nigeria,right,Attack - Centre-Forward,10/08/2024,30/06/2030,8,2,0,0,0,0,6,1,0,0,262',4,0,0,0,0,0,3,0,0,0,149',2,2,0,0,0,0,1,1,0,0,87',1,0,0,0,0,0,1,0,0,0,7',1.86,35000000.0,28.0,1997-09-14,2030-06-30,52.858081471747695
Tottenham Hotspur,Mathys Tel,27/04/2005 (20),France  Guadeloupe,right,Attack - Centre-Forward,01/07/2025,30/06/2031,21,3,0,0,0,0,13,7,0,0,759',16,3,0,0,0,0,10,5,0,0,539',1,0,0,0,0,0,1,0,0,0,32',1,0,0,0,0,0,0,1,0,0,78',1.83,30000000.0,20.0,2005-04-27,2031-06-30,64.84888304862024
Tottenham Hotspur,Richarlison,10/05/1997 (28),Brazil,right,Attack - Centre-Forward,01/07/2022,30/06/2027,31,8,0,3,7,0,10,9,0,0,1.901',21,7,0,3,3,0,8,3,0,0,1.278',6,1,0,0,2,0,1,3,0,0,413',1,0,0,0,0,0,0,1,0,0,31',1.84,28000000.0,28.0,1997-05-10,2027-06-30,16.852825229960576
Tottenham Hotspur,Randal Kolo Muani,05/12/1998 (27),France  DR Congo,right,Attack - Centre-Forward,01/09/2025,30/06/2026,24,3,0,3,4,0,10,12,0,0,1.329',15,0,0,0,2,0,4,9,0,0,930',7,3,0,2,2,0,4,3,0,0,315',1,0,0,1,0,0,1,0,0,0,59',1.87,25000000.0,27.0,1998-12-05,2026-06-30,4.862023653088042
Manchester United,Senne Lammens,07/07/2002 (23),Belgium,right,Goalkeeper,01/09/2025,30/06/2030,22,0,0,0,0,0,0,0,3,29,1.980',17,0,0,0,0,0,0,0,23,3,1.530',0,0,0,0,0,0,0,0,0,0,0,1,0,0,0,0,0,0,0,0,2,90',1.93,25000000.0,23.0,2002-07-07,2030-06-30,52.858081471747695
Manchester United,Altay Bayındır,14/04/1998 (27),Türkiye,right,Goalkeeper,01/09/2023,30/06/2027,6,0,0,0,0,0,0,0,0,11,540',6,0,0,0,0,0,0,0,11,0,540',0,0,0,0,0,0,0,0,0,0,0,0,0,0,0,0,0,0,0,0,0,0,1.98,7000000.0,27.0,1998-04-14,2027-06-30,16.852825229960576
Manchester United,Tom Heaton,15/04/1986 (39),England,right,Goalkeeper,02/07/2021,30/06/2026,0,0,0,0,0,0,0,0,0,0,0,0,0,0,0,0,0,0,0,0,0,0,0,0,0,0,0,0,0,0,0,0,0,0,0,0,0,0,0,0,0,0,0,0,1.88,150000.0,39.0,1986-04-15,2026-06-30,4.862023653088042
Manchester United,Leny Yoro,13/11/2005 (20),France  Cote d'Ivoire,right,Defender - Centre-Back,18/07/2024,30/06/2029,22,0,0,1,0,0,9,9,0,0,1.232',21,0,0,1,0,0,9,9,0,0,1.142',0,0,0,0,0,0,0,0,0,0,0,1,0,0,0,0,0,0,0,0,0,90',1.9,55000000.0,20.0,2005-11-13,2029-06-30,40.86727989487516
Manchester United,Matthijs de Ligt,12/08/1999 (26),Netherlands,right,Defender - Centre-Back,13/08/2024,30/06/2029,14,1,0,0,0,0,1,0,0,0,1.215',13,1,0,0,0,0,0,0,0,0,1.170',0,0,0,0,0,0,0,0,0,0,0,0,0,0,0,0,0,0,0,0,0,0,1.89,40000000.0,26.0,1999-08-12,2029-06-30,40.86727989487516
Manchester United,Lisandro Martínez,18/01/1998 (28),Argentina,left,Defender - Centre-Back,27/07/2022,30/06/2027,12,0,1,0,0,0,5,2,0,0,714',11,0,1,0,0,0,5,1,0,0,635',0,0,0,0,0,0,0,0,0,0,0,1,0,0,0,0,0,0,1,0,0,79',1.75,35000000.0,28.0,1998-01-18,2027-06-30,16.852825229960576
Manchester United,Harry Maguire,05/03/1993 (32),England,right,Defender - Centre-Back,05/08/2019,30/06/2026,12,2,0,1,1,0,5,3,0,0,625',10,1,0,1,0,0,4,3,0,0,524',0,0,0,0,0,0,0,0,0,0,0,1,0,0,0,1,0,1,0,0,0,11',1.94,10000000.0,32.0,1993-03-05,2026-06-30,4.862023653088042
Manchester United,Ayden Heaven,22/09/2006 (19),England  Ghana,left,Defender - Centre-Back,01/02/2025,30/06/2029,13,0,1,1,1,0,3,6,0,0,769',11,0,1,1,1,0,3,4,0,0,639',0,0,0,0,0,0,0,0,0,0,0,0,0,0,0,0,0,0,0,0,0,0,1.89,10000000.0,19.0,2006-09-22,2029-06-30,40.86727989487516
Manchester United,Tyler Fredricson,23/02/2005 (20),England,right,Defender - Centre-Back,01/07/2025,-,6,0,0,0,1,0,1,3,0,0,354',1,0,0,0,0,0,1,0,0,0,2',0,0,0,0,0,0,0,0,0,0,0,0,0,0,0,0,0,0,0,0,0,0,1.88,3000000.0,20.0,2005-02-23,,0.0
Manchester United,Patrick Dorgu,26/10/2004 (21),Denmark  Nigeria,left,Defender - Left-Back,02/02/2025,30/06/2030,24,3,0,3,5,0,8,5,0,0,1.468',22,3,0,3,5,0,8,4,0,0,1.333',0,0,0,0,0,0,0,0,0,0,0,1,0,0,0,0,0,0,0,0,0,90',1.85,30000000.0,21.0,2004-10-26,2030-06-30,52.858081471747695
Manchester United,Luke Shaw,12/07/1995 (30),England,left,Defender - Left-Back,01/07/2014,30/06/2027,23,0,0,1,4,0,0,10,0,0,2.006',23,0,0,1,4,0,0,10,0,0,2.006',0,0,0,0,0,0,0,0,0,0,0,0,0,0,0,0,0,0,0,0,0,0,1.78,10000000.0,30.0,1995-07-12,2027-06-30,16.852825229960576
Manchester United,Tyrell Malacia,17/08/1999 (26),Netherlands  Curacao,left,Defender - Left-Back,05/07/2022,30/06/2026,3,1,0,0,0,0,1,1,0,0,137',1,0,0,0,0,0,1,0,0,0,2',0,0,0,0,0,0,0,0,0,0,0,0,0,0,0,0,0,0,0,0,0,0,1.69,5000000.0,26.0,1999-08-17,2026-06-30,4.862023653088042
Manchester United,Diego León,03/04/2007 (18),Paraguay,left,Defender - Left-Back,05/07/2025,30/06/2029,11,1,0,0,2,0,1,5,0,0,797',0,0,0,0,0,0,0,0,0,0,0,0,0,0,0,0,0,0,0,0,0,0,0,0,0,0,0,0,0,0,0,0,0,1.77,4000000.0,18.0,2007-04-03,2029-06-30,40.86727989487516
Manchester United,Diogo Dalot,18/03/1999 (26),Portugal,right,Defender - Right-Back,01/07/2018,30/06/2028,23,1,0,2,3,0,3,5,0,0,1.769',21,1,0,2,3,0,3,5,0,0,1.589',0,0,0,0,0,0,0,0,0,0,0,1,0,0,0,0,0,0,0,0,0,90',1.83,28000000.0,26.0,1999-03-18,2028-06-30,28.876478318002626
Manchester United,Noussair Mazraoui,14/11/1997 (28),Morocco  Netherlands,right,Defender - Right-Back,13/08/2024,30/06/2028,10,0,0,0,1,0,4,5,0,0,445',10,0,0,0,1,0,4,5,0,0,445',0,0,0,0,0,0,0,0,0,0,0,0,0,0,0,0,0,0,0,0,0,0,1.83,22000000.0,28.0,1997-11-14,2028-06-30,28.876478318002626
Manchester United,Manuel Ugarte,11/04/2001 (24),Uruguay,right,Midfield - Defensive Midfield,30/08/2024,30/06/2029,18,0,0,0,1,0,9,7,0,0,859',16,0,0,0,1,0,9,5,0,0,735',0,0,0,0,0,0,0,0,0,0,0,1,0,0,0,0,0,0,1,0,0,79',1.82,30000000.0,24.0,2001-04-11,2029-06-30,40.86727989487516
Manchester United,Casemiro,23/02/1992 (33),Brazil  Spain,right,Midfield - Defensive Midfield,22/08/2022,30/06/2026,22,4,0,1,5,0,2,13,0,0,1.494',21,4,0,1,5,0,1,13,0,0,1.483',0,0,0,0,0,0,0,0,0,0,0,1,0,0,0,0,0,1,0,0,0,11',1.85,8000000.0,33.0,1992-02-23,2026-06-30,4.862023653088042
Manchester United,Kobbie Mainoo,19/04/2005 (20),England  Ghana,right,Midfield - Central Midfield,01/01/2023,30/06/2027,16,0,0,2,1,0,12,1,0,0,560',14,0,0,1,0,0,12,0,0,0,408',0,0,0,0,0,0,0,0,0,0,0,1,0,0,0,1,0,0,1,0,0,62',1.8,40000000.0,20.0,2005-04-19,2027-06-30,16.852825229960576
Manchester United,Bruno Fernandes,08/09/1994 (31),Portugal,right,Midfield - Attacking Midfield,29/01/2020,30/06/2027,22,5,0,11,2,0,1,5,0,0,1.853',20,5,0,10,2,0,0,5,0,0,1.718',0,0,0,0,0,0,0,0,0,0,0,1,0,0,1,0,0,0,0,0,0,90',1.79,40000000.0,31.0,1994-09-08,2027-06-30,16.852825229960576
Manchester United,Mason Mount,10/01/1999 (27),England,right,Midfield - Attacking Midfield,05/07/2023,30/06/2028,19,3,0,1,0,0,8,9,0,0,907',17,3,0,0,0,0,7,8,0,0,818',0,0,0,0,0,0,0,0,0,0,0,1,0,0,0,0,0,0,1,0,0,62',1.81,32000000.0,27.0,1999-01-10,2028-06-30,28.876478318002626
Manchester United,Bryan Mbeumo,07/08/1999 (26),Cameroon  France,left,Attack - Right Winger,21/07/2025,30/06/2030,19,9,0,1,3,0,1,6,0,0,1.591',18,8,0,1,3,0,0,6,0,0,1.546',0,0,0,0,0,0,0,0,0,0,0,0,0,0,0,0,0,0,0,0,0,0,1.71,75000000.0,26.0,1999-08-07,2030-06-30,52.858081471747695
Manchester United,Amad Diallo,11/07/2002 (23),Cote d'Ivoire  Italy,left,Attack - Right Winger,02/01/2021,30/06/2030,18,2,0,3,1,0,1,6,0,0,1.466',17,2,0,3,1,0,1,5,0,0,1.384',0,0,0,0,0,0,0,0,0,0,0,0,0,0,0,0,0,0,0,0,0,0,1.73,50000000.0,23.0,2002-07-11,2030-06-30,52.858081471747695
Manchester United,Matheus Cunha,27/05/1999 (26),Brazil,right,Attack - Centre-Forward,01/07/2025,30/06/2030,22,5,0,2,1,0,4,5,0,0,1.595',20,5,0,2,1,0,4,5,0,0,1.415',0,0,0,0,0,0,0,0,0,0,0,1,0,0,0,0,0,0,0,0,0,90',1.83,70000000.0,26.0,1999-05-27,2030-06-30,52.858081471747695
Manchester United,Benjamin Sesko,31/05/2003 (22),Slovenia,right,Attack - Centre-Forward,09/08/2025,30/06/2030,20,5,0,1,1,0,7,5,0,0,1.231',18,4,0,1,1,0,7,5,0,0,1.051',0,0,0,0,0,0,0,0,0,0,0,1,1,0,0,0,0,0,0,0,0,90',1.95,60000000.0,22.0,2003-05-31,2030-06-30,52.858081471747695
Manchester United,Joshua Zirkzee,22/05/2001 (24),Netherlands  Nigeria,right,Attack - Centre-Forward,14/07/2024,30/06/2029,16,2,0,1,2,0,12,2,0,0,518',14,2,0,1,1,0,10,2,0,0,482',0,0,0,0,0,0,0,0,0,0,0,1,0,0,0,0,0,1,0,0,0,28',1.93,25000000.0,24.0,2001-05-22,2029-06-30,40.86727989487516
Manchester United,Chido Obi,29/11/2007 (18),Denmark  Nigeria,right,Attack - Centre-Forward,01/07/2025,-,20,8,0,4,1,0,9,7,0,0,1.126',0,0,0,0,0,0,0,0,0,0,0,0,0,0,0,0,0,0,0,0,0,0,0,0,0,0,0,0,0,0,0,0,0,1.88,5000000.0,18.0,2007-11-29,,0.0
Manchester United,Ethan Wheatley,20/01/2006 (20),England,0,Attack - Centre-Forward,01/07/2025,30/06/2028,25,3,1,4,4,0,3,12,0,0,1.811',0,0,0,0,0,0,0,0,0,0,0,0,0,0,0,0,0,0,0,0,0,0,1,0,0,0,0,0,0,0,0,0,90',1.87,150000.0,20.0,2006-01-20,2028-06-30,28.876478318002626
Newcastle United,Aaron Ramsdale,14/05/1998 (27),England,right,Goalkeeper,02/08/2025,30/06/2026,12,0,0,0,1,0,1,0,1,17,1.033',7,0,0,0,0,0,1,0,10,0,553',1,0,0,0,1,0,0,0,0,2,90',1,0,0,0,0,0,0,0,0,3,120',1.9,12000000.0,27.0,1998-05-14,2026-06-30,4.862023653088042
Newcastle United,Nick Pope,19/04/1992 (33),England,right,Goalkeeper,01/07/2022,30/06/2026,25,0,0,0,1,0,0,1,11,26,2.237',17,0,0,0,1,0,0,1,19,7,1.517',7,0,0,0,0,0,0,0,4,5,630',0,0,0,0,0,0,0,0,0,0,0,1.98,7000000.0,33.0,1992-04-19,2026-06-30,4.862023653088042
Newcastle United,Mark Gillespie,27/03/1992 (33),England,right,Goalkeeper,03/07/2020,30/06/2026,279,0,0,0,13,1,2,2,67,396,25.041',0,0,0,0,0,0,0,0,0,0,0,0,0,0,0,0,0,0,0,0,0,0,6,0,0,0,0,0,0,0,1,11,570',1.91,150000.0,33.0,1992-03-27,2026-06-30,4.862023653088042
Newcastle United,John Ruddy,24/10/1986 (39),England,right,Goalkeeper,01/07/2024,-,0,0,0,0,0,0,0,0,0,0,0,0,0,0,0,0,0,0,0,0,0,0,0,0,0,0,0,0,0,0,0,0,0,0,0,0,0,0,0,0,0,0,0,0,1.92,100000.0,39.0,1986-10-24,,0.0
Newcastle United,Malick Thiaw,08/08/2001 (24),Germany  Finland,right,Defender - Centre-Back,12/08/2025,-,33,3,0,0,6,0,2,2,0,0,2.805',20,3,0,0,3,0,1,2,0,0,1.668',8,0,0,0,2,0,1,0,0,0,657',1,0,0,0,0,0,0,0,0,0,120',1.94,40000000.0,24.0,2001-08-08,,0.0
Newcastle United,Sven Botman,12/01/2000 (26),Netherlands,left,Defender - Centre-Back,01/07/2022,30/06/2030,22,0,1,1,1,0,4,4,0,0,1.647',13,0,1,1,1,0,3,3,0,0,884',6,0,0,0,0,0,1,0,0,0,464',1,0,0,0,0,0,0,0,0,0,120',1.93,35000000.0,26.0,2000-01-12,2030-06-30,52.858081471747695
Newcastle United,Fabian Schär,20/12/1991 (34),Switzerland,right,Defender - Centre-Back,26/07/2018,30/06/2026,21,1,0,0,3,0,6,4,0,0,1.402',16,0,0,0,1,0,5,2,0,0,1.091',3,0,0,0,0,0,1,2,0,0,131',0,0,0,0,0,0,0,0,0,0,0,1.86,6000000.0,34.0,1991-12-20,2026-06-30,4.862023653088042
Newcastle United,Dan Burn,09/05/1992 (33),England,left,Defender - Centre-Back,31/01/2022,30/06/2027,23,1,0,4,5,0,0,3,0,0,1.953',15,0,0,3,3,0,0,2,0,0,1.258',7,1,0,1,2,0,0,1,0,0,605',0,0,0,0,0,0,0,0,0,0,0,2.01,5000000.0,33.0,1992-05-09,2027-06-30,16.852825229960576
Newcastle United,Jamaal Lascelles,11/11/1993 (32),England  Barbados,right,Defender - Centre-Back,09/08/2014,30/06/2026,2,0,0,0,0,0,2,0,0,0,19',2,0,0,0,0,0,2,0,0,0,19',0,0,0,0,0,0,0,0,0,0,0,0,0,0,0,0,0,0,0,0,0,0,1.88,2000000.0,32.0,1993-11-11,2026-06-30,4.862023653088042
Newcastle United,Lewis Hall,08/09/2004 (21),England,left,Defender - Left-Back,01/07/2024,-,26,0,0,1,2,0,8,4,0,0,1.767',16,0,0,1,1,0,4,3,0,0,1.123',6,0,0,0,0,0,3,0,0,0,342',1,0,0,0,0,0,1,0,0,0,61',1.79,32000000.0,21.0,2004-09-08,,0.0
Newcastle United,Alex Murphy,25/06/2004 (21),Ireland,left,Defender - Left-Back,01/07/2025,30/06/2028,7,0,0,0,1,0,2,2,0,0,420',0,0,0,0,0,0,0,0,0,0,0,0,0,0,0,0,0,0,0,0,0,0,0,0,0,0,0,0,0,0,0,0,0,1.88,300000.0,21.0,2004-06-25,2028-06-30,28.876478318002626
Newcastle United,Tino Livramento,12/11/2002 (23),England  Scotland,right,Defender - Right-Back,08/08/2023,30/06/2028,19,0,0,1,1,0,3,4,0,0,1.453',13,0,0,1,1,0,2,1,0,0,1.049',3,0,0,0,0,0,0,1,0,0,240',1,0,0,0,0,0,0,1,0,0,59',1.82,40000000.0,23.0,2002-11-12,2028-06-30,28.876478318002626
Newcastle United,Kieran Trippier,19/09/1990 (35),England,right,Defender - Right-Back,07/01/2022,30/06/2026,20,0,0,1,3,0,4,6,0,0,1.425',11,0,0,0,1,0,1,2,0,0,880',5,0,0,1,0,0,0,3,0,0,426',1,0,0,0,0,0,0,1,0,0,69',1.73,2500000.0,35.0,1990-09-19,2026-06-30,4.862023653088042
Newcastle United,Emil Krafth,02/08/1994 (31),Sweden,right,Defender - Right-Back,08/08/2019,30/06/2026,3,0,0,0,0,0,0,3,0,0,178',1,0,0,0,0,0,0,1,0,0,45',0,0,0,0,0,0,0,0,0,0,0,0,0,0,0,0,0,0,0,0,0,0,1.84,1500000.0,31.0,1994-08-02,2026-06-30,4.862023653088042
Newcastle United,Sandro Tonali,08/05/2000 (25),Italy,right,Midfield - Defensive Midfield,03/07/2023,30/06/2028,34,0,0,5,5,0,5,10,0,0,2.463',23,0,0,1,3,0,3,10,0,0,1.584',7,0,0,1,1,0,0,0,0,0,630',1,0,0,1,0,0,0,0,0,0,120',1.81,75000000.0,25.0,2000-05-08,2028-06-30,28.876478318002626
Newcastle United,Bruno Guimarães,16/11/1997 (28),Brazil  Spain,right,Midfield - Central Midfield,30/01/2022,30/06/2028,33,8,1,6,7,0,3,8,0,0,2.703',21,8,0,4,4,0,1,3,0,0,1.841',7,0,1,0,1,0,0,4,0,0,544',1,0,0,0,1,0,1,0,0,0,41',1.82,75000000.0,28.0,1997-11-16,2028-06-30,28.876478318002626
Newcastle United,Jacob Ramsey,28/05/2001 (24),England,right,Midfield - Central Midfield,17/08/2025,-,23,0,0,0,2,0,13,8,0,0,1.064',13,0,0,0,2,0,9,4,0,0,549',6,0,0,0,0,0,4,1,0,0,197',1,0,0,0,0,0,0,1,0,0,79',1.8,35000000.0,24.0,2001-05-28,,0.0
Newcastle United,Joelinton,14/08/1996 (29),Brazil,right,Midfield - Central Midfield,23/07/2019,30/06/2028,29,5,0,1,10,0,5,13,0,0,1.988',19,2,0,0,6,0,2,9,0,0,1.369',6,1,0,1,2,0,1,4,0,0,370',1,0,0,0,0,0,1,0,0,0,50',1.86,30000000.0,29.0,1996-08-14,2028-06-30,28.876478318002626
Newcastle United,Lewis Miley,01/05/2006 (19),England,right,Midfield - Central Midfield,01/07/2023,30/06/2029,30,3,0,3,0,0,14,2,0,0,1.795',19,1,0,3,0,0,8,2,0,0,1.134',7,1,0,0,0,0,5,0,0,0,340',1,0,0,0,0,0,1,0,0,0,51',1.89,20000000.0,19.0,2006-05-01,2029-06-30,40.86727989487516
Newcastle United,Joe Willock,20/08/1999 (26),England  Montserrat,right,Midfield - Central Midfield,13/08/2021,30/06/2027,20,1,0,1,2,0,13,7,0,0,626',12,0,0,0,1,0,10,2,0,0,241',5,1,0,0,1,0,3,2,0,0,172',1,0,0,0,0,0,0,1,0,0,70',1.86,16000000.0,26.0,1999-08-20,2027-06-30,16.852825229960576
Newcastle United,Anthony Gordon,24/02/2001 (24),England,right,Attack - Left Winger,29/01/2023,-,31,9,0,4,3,1,6,20,0,0,1.895',18,2,0,1,2,1,2,13,0,0,1.137',8,6,0,2,1,0,1,5,0,0,563',1,1,0,1,0,0,1,0,0,0,51',1.83,60000000.0,24.0,2001-02-24,,0.0
Newcastle United,Harvey Barnes,09/12/1997 (28),England  Scotland,right,Attack - Left Winger,23/07/2023,30/06/2028,35,12,0,2,0,0,16,12,0,0,1.942',22,5,0,0,0,0,11,8,0,0,1.129',8,5,0,1,0,0,3,3,0,0,452',1,2,0,0,0,0,0,0,0,0,120',1.82,32000000.0,28.0,1997-12-09,2028-06-30,28.876478318002626
Newcastle United,Anthony Elanga,27/04/2002 (23),Sweden  Cameroon,right,Attack - Right Winger,11/07/2025,-,30,0,0,2,1,0,18,10,0,0,1.192',19,0,0,1,0,0,12,5,0,0,729',7,0,0,1,1,0,4,3,0,0,279',0,0,0,0,0,0,0,0,0,0,0,1.78,50000000.0,23.0,2002-04-27,,0.0
Newcastle United,Jacob Murphy,24/02/1995 (30),England  Ireland,right,Attack - Right Winger,19/07/2017,30/06/2027,25,2,0,3,0,0,9,15,0,0,1.356',18,2,0,1,0,0,6,11,0,0,1.015',5,0,0,2,0,0,3,2,0,0,211',0,0,0,0,0,0,0,0,0,0,0,1.79,15000000.0,30.0,1995-02-24,2027-06-30,16.852825229960576
Newcastle United,Nick Woltemade,14/02/2002 (23),Germany,right,Attack - Centre-Forward,30/08/2025,01/07/2031,36,10,1,4,1,0,10,20,0,0,2.318',20,7,1,2,0,0,3,14,0,0,1.364',8,1,0,1,0,0,3,5,0,0,474',1,0,0,1,0,0,0,0,0,0,120',1.98,70000000.0,23.0,2002-02-14,2031-07-01,64.88173455978975
Newcastle United,Yoane Wissa,03/09/1996 (29),DR Congo  France,right,Attack - Centre-Forward,01/09/2025,-,15,3,0,1,1,0,8,7,0,0,622',9,1,0,0,1,0,6,3,0,0,328',3,1,0,1,0,0,2,1,0,0,84',1,0,0,0,0,0,0,1,0,0,69',1.76,35000000.0,29.0,1996-09-03,,0.0
Newcastle United,William Osula,04/08/2003 (22),Denmark  England,right,Attack - Centre-Forward,08/08/2024,30/06/2029,14,3,0,1,0,0,12,0,0,0,344',10,1,0,0,0,0,9,0,0,0,213',2,0,0,1,0,0,2,0,0,0,22',0,0,0,0,0,0,0,0,0,0,0,1.91,15000000.0,22.0,2003-08-04,2029-06-30,40.86727989487516
Nottingham Forest,John Victor,13/02/1996 (29),Brazil  Portugal,right,Goalkeeper,31/08/2025,30/06/2028,9,0,0,0,1,0,0,1,3,12,798',5,0,0,0,1,0,0,1,8,1,438',0,0,0,0,0,0,0,0,0,0,0,0,0,0,0,0,0,0,0,0,0,0,1.97,7000000.0,29.0,1996-02-13,2028-06-30,28.876478318002626
Nottingham Forest,Matz Sels,26/02/1992 (33),Belgium,right,Goalkeeper,01/02/2024,30/06/2027,25,0,0,0,1,0,1,0,7,35,2.202',19,0,0,0,1,0,1,0,26,5,1.632',0,0,0,0,0,0,0,0,0,0,0,1,0,0,0,0,0,0,0,0,3,120',1.88,6000000.0,33.0,1992-02-26,2027-06-30,16.852825229960576
Nottingham Forest,Angus Gunn,22/01/1996 (30),Scotland  England,right,Goalkeeper,06/08/2025,30/06/2026,0,0,0,0,0,0,0,0,0,0,0,0,0,0,0,0,0,0,0,0,0,0,0,0,0,0,0,0,0,0,0,0,0,0,0,0,0,0,0,0,0,0,0,0,1.96,1500000.0,30.0,1996-01-22,2026-06-30,4.862023653088042
Nottingham Forest,Murillo,04/07/2002 (23),Brazil,left,Defender - Centre-Back,31/08/2023,30/06/2029,24,1,1,0,4,0,3,5,0,0,1.769',17,1,1,0,3,0,0,2,0,0,1.461',0,0,0,0,0,0,0,0,0,0,0,1,0,0,0,0,0,1,0,0,0,23',1.8,55000000.0,23.0,2002-07-04,2029-06-30,40.86727989487516
Nottingham Forest,Nikola Milenković,12/10/1997 (28),Serbia,right,Defender - Centre-Back,18/07/2024,30/06/2029,31,1,1,0,4,0,1,2,0,0,2.709',23,0,1,0,4,0,0,0,0,0,2.070',0,0,0,0,0,0,0,0,0,0,0,0,0,0,0,0,0,0,0,0,0,0,1.95,30000000.0,28.0,1997-10-12,2029-06-30,40.86727989487516
Nottingham Forest,Morato,30/06/2001 (24),Brazil,left,Defender - Centre-Back,30/08/2024,30/06/2029,20,0,0,0,6,0,3,2,0,0,1.508',11,0,0,0,4,0,3,1,0,0,713',0,0,0,0,0,0,0,0,0,0,0,1,0,0,0,1,0,0,0,0,0,120',1.92,14000000.0,24.0,2001-06-30,2029-06-30,40.86727989487516
Nottingham Forest,Jair Cunha,07/03/2005 (20),Brazil,both,Defender - Centre-Back,11/07/2025,30/06/2030,5,0,0,0,0,0,1,0,0,0,435',1,0,0,0,0,0,0,0,0,0,90',0,0,0,0,0,0,0,0,0,0,0,1,0,0,0,0,0,0,0,0,0,120',1.98,12000000.0,20.0,2005-03-07,2030-06-30,52.858081471747695
Nottingham Forest,Willy Boly,03/02/1991 (34),Cote d'Ivoire  France,right,Defender - Centre-Back,01/09/2022,30/06/2026,2,0,0,0,0,0,1,0,0,0,91',0,0,0,0,0,0,0,0,0,0,0,0,0,0,0,0,0,0,0,0,0,0,0,0,0,0,0,0,0,0,0,0,0,1.95,800000.0,34.0,1991-02-03,2026-06-30,4.862023653088042
Nottingham Forest,Zach Abbott,13/05/2006 (19),England,right,Defender - Centre-Back,01/07/2025,30/06/2029,19,0,1,0,3,0,2,0,0,0,1.585',1,0,0,0,0,0,1,0,0,0,45',0,0,0,0,0,0,0,0,0,0,0,0,0,0,0,0,0,0,0,0,0,0,1.8,300000.0,19.0,2006-05-13,2029-06-30,40.86727989487516
Nottingham Forest,Neco Williams,13/04/2001 (24),Wales,right,Defender - Left-Back,10/07/2022,30/06/2029,31,1,0,1,5,0,3,1,0,0,2.608',23,1,0,1,4,0,0,0,0,0,2.070',0,0,0,0,0,0,0,0,0,0,0,1,0,0,0,0,0,1,0,0,0,75',1.83,25000000.0,24.0,2001-04-13,2029-06-30,40.86727989487516
Nottingham Forest,Oleksandr Zinchenko,15/12/1996 (29),Ukraine,left,Defender - Left-Back,01/09/2025,30/06/2026,10,0,0,0,0,0,1,3,0,0,713',5,0,0,0,0,0,1,1,0,0,353',0,0,0,0,0,0,0,0,0,0,0,1,0,0,0,0,0,0,1,0,0,45',1.75,15000000.0,29.0,1996-12-15,2026-06-30,4.862023653088042
Nottingham Forest,Cuiabano,16/02/2003 (22),Brazil,left,Defender - Left-Back,01/09/2025,30/06/2029,2,0,0,0,0,0,0,0,0,0,180',0,0,0,0,0,0,0,0,0,0,0,0,0,0,0,0,0,0,0,0,0,0,0,0,0,0,0,0,0,0,0,0,0,1.79,8000000.0,22.0,2003-02-16,2029-06-30,40.86727989487516
Nottingham Forest,Ola Aina,08/10/1996 (29),Nigeria  England,right,Defender - Right-Back,22/07/2023,30/06/2028,11,0,0,0,3,0,1,3,0,0,854',7,0,0,0,2,0,0,1,0,0,609',0,0,0,0,0,0,0,0,0,0,0,0,0,0,0,0,0,0,0,0,0,0,1.84,20000000.0,29.0,1996-10-08,2028-06-30,28.876478318002626
Nottingham Forest,Nicolò Savona,19/03/2003 (22),Italy,right,Defender - Right-Back,30/08/2025,30/06/2030,20,2,0,2,3,0,5,3,0,0,1.500',14,2,0,0,2,0,3,2,0,0,1.026',0,0,0,0,0,0,0,0,0,0,0,1,0,0,2,0,0,0,1,0,0,97',1.92,15000000.0,22.0,2003-03-19,2030-06-30,52.858081471747695
Nottingham Forest,Eric da Silva Moreira,03/05/2006 (19),Germany  Portugal,right,Defender - Right-Back,01/07/2024,30/06/2028,6,0,0,0,0,0,3,3,0,0,304',0,0,0,0,0,0,0,0,0,0,0,0,0,0,0,0,0,0,0,0,0,0,0,0,0,0,0,0,0,0,0,0,0,1.85,1000000.0,19.0,2006-05-03,2028-06-30,28.876478318002626
Nottingham Forest,Ibrahim Sangaré,02/12/1997 (28),Cote d'Ivoire,right,Midfield - Defensive Midfield,01/09/2023,30/06/2028,24,2,0,3,3,0,6,10,0,0,1.503',15,2,0,2,2,0,2,7,0,0,1.050',0,0,0,0,0,0,0,0,0,0,0,0,0,0,0,0,0,0,0,0,0,0,1.91,22000000.0,28.0,1997-12-02,2028-06-30,28.876478318002626
Nottingham Forest,Elliot Anderson,06/11/2002 (23),England  Scotland,right,Midfield - Central Midfield,01/07/2024,30/06/2029,29,1,0,2,6,1,3,1,0,0,2.431',23,1,0,2,4,0,0,0,0,0,2.070',0,0,0,0,0,0,0,0,0,0,0,0,0,0,0,0,0,0,0,0,0,0,1.79,60000000.0,23.0,2002-11-06,2029-06-30,40.86727989487516
Nottingham Forest,Nicolás Domínguez,28/06/1998 (27),Argentina  Italy,right,Midfield - Central Midfield,01/09/2023,30/06/2028,20,1,0,0,4,0,6,12,0,0,1.127',14,1,0,0,2,0,4,9,0,0,719',0,0,0,0,0,0,0,0,0,0,0,1,0,0,0,1,0,1,0,0,0,75',1.79,16000000.0,27.0,1998-06-28,2028-06-30,28.876478318002626
Nottingham Forest,Ryan Yates,21/11/1997 (28),England,right,Midfield - Central Midfield,01/07/2016,30/06/2028,18,1,1,3,3,0,12,3,0,0,757',11,0,0,1,1,0,10,2,0,0,301',0,0,0,0,0,0,0,0,0,0,0,0,0,0,0,0,0,0,0,0,0,0,1.9,10000000.0,28.0,1997-11-21,2028-06-30,28.876478318002626
Nottingham Forest,Morgan Gibbs-White,27/01/2000 (26),England  Jamaica,right,Midfield - Attacking Midfield,19/08/2022,30/06/2028,32,6,0,4,3,0,5,9,0,0,2.546',23,5,0,2,0,0,1,8,0,0,1.969',0,0,0,0,0,0,0,0,0,0,0,1,0,0,0,0,0,1,0,0,0,75',1.71,65000000.0,26.0,2000-01-27,2028-06-30,28.876478318002626
Nottingham Forest,Omari Hutchinson,30/10/2003 (22),England  Jamaica,left,Midfield - Attacking Midfield,16/08/2025,30/06/2030,20,1,0,5,1,0,10,1,0,0,1.117',18,1,0,4,0,0,10,1,0,0,907',0,0,0,0,0,0,0,0,0,0,0,1,0,0,0,1,0,0,0,0,0,120',1.74,30000000.0,22.0,2003-10-30,2030-06-30,52.858081471747695
Nottingham Forest,James McAtee,18/10/2002 (23),England,left,Midfield - Attacking Midfield,16/08/2025,30/06/2030,14,1,0,0,1,0,6,7,0,0,652',7,0,0,0,1,0,6,1,0,0,170',0,0,0,0,0,0,0,0,0,0,0,1,0,0,0,0,0,0,1,0,0,45',1.8,23000000.0,23.0,2002-10-18,2030-06-30,52.858081471747695
Nottingham Forest,Callum Hudson-Odoi,07/11/2000 (25),England  Ghana,right,Attack - Left Winger,01/09/2023,30/06/2028,30,5,0,1,0,0,12,11,0,0,1.848',21,3,0,1,0,0,8,10,0,0,1.299',0,0,0,0,0,0,0,0,0,0,0,1,2,0,0,0,0,1,0,0,0,51',1.78,30000000.0,25.0,2000-11-07,2028-06-30,28.876478318002626
Nottingham Forest,Dan Ndoye,25/10/2000 (25),Switzerland  Senegal,right,Attack - Right Winger,31/07/2025,30/06/2030,25,2,0,2,2,0,5,12,0,0,1.613',16,1,0,1,1,0,2,11,0,0,1.020',0,0,0,0,0,0,0,0,0,0,0,1,0,0,0,0,0,0,1,0,0,69',1.84,40000000.0,25.0,2000-10-25,2030-06-30,52.858081471747695
Nottingham Forest,Dilane Bakwa,26/08/2002 (23),France  DR Congo,left,Attack - Right Winger,01/09/2025,30/06/2030,19,1,0,4,1,0,12,8,0,0,758',8,0,0,1,1,0,5,4,0,0,304',0,0,0,0,0,0,0,0,0,0,0,1,0,0,0,0,0,0,1,0,0,45',1.8,32000000.0,23.0,2002-08-26,2030-06-30,52.858081471747695
Nottingham Forest,Lorenzo Lucca,10/09/2000 (25),Italy,right,Attack - Centre-Forward,23/01/2026,30/06/2026,23,2,0,0,1,1,17,5,0,0,595',0,0,0,0,0,0,0,0,0,0,0,5,0,0,0,0,1,4,0,0,0,118',0,0,0,0,0,0,0,0,0,0,0,2.01,25000000.0,25.0,2000-09-10,2026-06-30,4.862023653088042
Nottingham Forest,Igor Jesus,25/02/2001 (24),Brazil  United Arab Emirates,right,Attack - Centre-Forward,05/07/2025,30/06/2029,30,11,0,1,4,0,9,15,0,0,1.783',22,2,0,1,0,0,7,11,0,0,1.296',0,0,0,0,0,0,0,0,0,0,0,1,1,0,0,0,0,0,0,0,0,120',1.79,20000000.0,24.0,2001-02-25,2029-06-30,40.86727989487516
Nottingham Forest,Taiwo Awoniyi,12/08/1997 (28),Nigeria,right,Attack - Centre-Forward,01/07/2022,30/06/2027,9,1,0,0,0,0,8,1,0,0,236',8,1,0,0,0,0,7,1,0,0,204',0,0,0,0,0,0,0,0,0,0,0,1,0,0,0,0,0,1,0,0,0,32',1.83,12000000.0,28.0,1997-08-12,2027-06-30,16.852825229960576
Nottingham Forest,Chris Wood,07/12/1991 (34),New Zealand,right,Attack - Centre-Forward,01/07/2023,30/06/2027,9,3,0,0,0,0,2,7,0,0,560',8,2,0,0,0,0,1,7,0,0,545',0,0,0,0,0,0,0,0,0,0,0,0,0,0,0,0,0,0,0,0,0,0,1.91,8000000.0,34.0,1991-12-07,2027-06-30,16.852825229960576
Aston Villa,Emiliano Martínez,02/09/1992 (33),Argentina  Spain,right,Goalkeeper,16/09/2020,30/06/2029,23,0,0,0,1,0,0,1,7,22,2.025',19,0,0,0,1,0,0,1,17,6,1.665',0,0,0,0,0,0,0,0,0,0,0,0,0,0,0,0,0,0,0,0,0,0,1.95,15000000.0,33.0,1992-09-02,2029-06-30,40.86727989487516
Aston Villa,Marco Bizot,10/03/1991 (34),Netherlands,right,Goalkeeper,15/07/2025,30/06/2027,11,0,0,0,2,0,1,0,5,11,945',5,0,0,0,1,0,1,0,8,2,405',0,0,0,0,0,0,0,0,0,0,0,1,0,0,0,0,0,0,0,0,1,90',1.93,2500000.0,34.0,1991-03-10,2027-06-30,16.852825229960576
Aston Villa,Ezri Konsa,23/10/1997 (28),England  DR Congo,right,Defender - Centre-Back,11/07/2019,30/06/2028,30,0,0,0,1,1,2,0,0,0,2.550',22,0,0,0,0,1,0,0,0,0,1.956',0,0,0,0,0,0,0,0,0,0,0,1,0,0,0,0,0,0,0,0,0,90',1.83,35000000.0,28.0,1997-10-23,2028-06-30,28.876478318002626
Aston Villa,Pau Torres,16/01/1997 (29),Spain,left,Defender - Centre-Back,12/07/2023,30/06/2028,21,0,1,0,0,0,2,5,0,0,1.693',14,0,1,0,0,0,2,3,0,0,1.119',0,0,0,0,0,0,0,0,0,0,0,1,0,0,0,0,0,0,0,0,0,90',1.92,25000000.0,29.0,1997-01-16,2028-06-30,28.876478318002626
Aston Villa,Victor Lindelöf,17/07/1994 (31),Sweden,right,Defender - Centre-Back,01/09/2025,30/06/2027,18,0,1,1,2,0,6,1,0,0,1.086',11,0,0,1,0,0,5,0,0,0,566',0,0,0,0,0,0,0,0,0,0,0,0,0,0,0,0,0,0,0,0,0,0,1.87,6000000.0,31.0,1994-07-17,2027-06-30,16.852825229960576
Aston Villa,Tyrone Mings,13/03/1993 (32),England,left,Defender - Centre-Back,08/07/2019,30/06/2027,11,1,0,0,0,0,2,1,0,0,783',8,0,0,0,0,0,2,1,0,0,513',0,0,0,0,0,0,0,0,0,0,0,0,0,0,0,0,0,0,0,0,0,0,1.96,4000000.0,32.0,1993-03-13,2027-06-30,16.852825229960576
Aston Villa,Ian Maatsen,10/03/2002 (23),Netherlands  Suriname,left,Defender - Left-Back,01/07/2024,30/06/2030,25,1,0,1,3,0,9,10,0,0,1.462',17,0,0,1,2,0,8,7,0,0,857',0,0,0,0,0,0,0,0,0,0,0,1,0,0,0,0,0,0,1,0,0,78',1.78,25000000.0,23.0,2002-03-10,2030-06-30,52.858081471747695
Aston Villa,Lucas Digne,20/07/1993 (32),France,left,Defender - Left-Back,13/01/2022,30/06/2028,28,0,0,4,4,0,11,7,0,0,1.540',22,0,0,4,3,0,8,7,0,0,1.230',0,0,0,0,0,0,0,0,0,0,0,1,0,0,0,0,0,1,0,0,0,12',1.78,8000000.0,32.0,1993-07-20,2028-06-30,28.876478318002626
Aston Villa,Matty Cash,07/08/1997 (28),Poland  England,right,Defender - Right-Back,03/09/2020,30/06/2029,30,3,0,4,7,0,2,8,0,0,2.489',22,3,0,2,5,0,0,4,0,0,1.955',0,0,0,0,0,0,0,0,0,0,0,1,0,0,0,0,0,0,1,0,0,79',1.85,22000000.0,28.0,1997-08-07,2029-06-30,40.86727989487516
Aston Villa,Andrés García,07/02/2003 (22),Spain,right,Defender - Right-Back,21/01/2025,-,4,0,0,0,1,0,4,0,0,0,56',2,0,0,0,0,0,2,0,0,0,30',0,0,0,0,0,0,0,0,0,0,0,1,0,0,0,1,0,1,0,0,0,11',1.85,7000000.0,22.0,2003-02-07,,0.0
Aston Villa,Amadou Onana,16/08/2001 (24),Belgium  Senegal,right,Midfield - Defensive Midfield,22/07/2024,30/06/2029,21,2,0,0,3,0,4,13,0,0,1.347',15,2,0,0,2,0,3,8,0,0,981',0,0,0,0,0,0,0,0,0,0,0,0,0,0,0,0,0,0,0,0,0,0,1.95,42000000.0,24.0,2001-08-16,2029-06-30,40.86727989487516
Aston Villa,Boubacar Kamara,23/11/1999 (26),France  Senegal,right,Midfield - Defensive Midfield,01/07/2022,30/06/2030,26,1,0,4,5,0,6,9,0,0,1.713',18,1,0,3,5,0,1,8,0,0,1.418',0,0,0,0,0,0,0,0,0,0,0,1,0,0,0,0,0,0,1,0,0,9',1.84,40000000.0,26.0,1999-11-23,2030-06-30,52.858081471747695
Aston Villa,Lamare Bogarde,05/01/2004 (22),Netherlands  Suriname,right,Midfield - Defensive Midfield,01/07/2024,-,27,0,0,0,7,0,14,6,0,0,1.233',18,0,0,0,5,0,13,4,0,0,524',0,0,0,0,0,0,0,0,0,0,0,1,0,0,0,0,0,0,0,0,0,90',1.85,12000000.0,22.0,2004-01-05,,0.0
Aston Villa,Youri Tielemans,07/05/1997 (28),Belgium  DR Congo,right,Midfield - Central Midfield,01/07/2023,30/06/2028,22,1,0,5,1,0,5,7,0,0,1.590',17,0,0,4,0,0,2,5,0,0,1.299',0,0,0,0,0,0,0,0,0,0,0,1,0,0,0,0,0,1,0,0,0,81',1.77,35000000.0,28.0,1997-05-07,2028-06-30,28.876478318002626
Aston Villa,Douglas Luiz,09/05/1998 (27),Brazil,right,Midfield - Central Midfield,28/01/2026,30/06/2026,14,0,0,1,3,0,3,11,0,0,710',8,0,0,0,2,0,3,5,0,0,317',0,0,0,0,0,0,0,0,0,0,0,1,0,0,0,1,0,0,1,0,0,88',1.77,25000000.0,27.0,1998-05-09,2026-06-30,4.862023653088042
Aston Villa,John McGinn,18/10/1994 (31),Scotland,left,Midfield - Central Midfield,08/08/2018,30/06/2028,29,5,0,4,5,0,4,18,0,0,1.978',22,3,0,3,3,0,1,16,0,0,1.607',0,0,0,0,0,0,0,0,0,0,0,1,0,0,0,0,0,0,1,0,0,65',1.78,15000000.0,31.0,1994-10-18,2028-06-30,28.876478318002626
Aston Villa,Ross Barkley,05/12/1993 (32),England,right,Midfield - Central Midfield,01/07/2024,30/06/2026,8,1,0,0,0,0,8,1,0,0,146',7,1,0,0,0,0,7,1,0,0,115',0,0,0,0,0,0,0,0,0,0,0,0,0,0,0,0,0,0,0,0,0,0,1.89,5000000.0,32.0,1993-12-05,2026-06-30,4.862023653088042
Aston Villa,Morgan Rogers,26/07/2002 (23),England,right,Midfield - Attacking Midfield,01/02/2024,30/06/2031,33,9,0,7,5,0,4,6,0,0,2.646',23,7,0,5,4,0,0,3,0,0,2.050',0,0,0,0,0,0,0,0,0,0,0,1,1,0,0,0,0,0,0,0,0,90',1.87,70000000.0,23.0,2002-07-26,2031-06-30,64.84888304862024
Aston Villa,Harvey Elliott,04/04/2003 (22),England,left,Midfield - Attacking Midfield,01/09/2025,30/06/2026,8,1,0,0,0,0,5,2,0,0,264',4,0,0,0,0,0,3,1,0,0,97',0,0,0,0,0,0,0,0,0,0,0,0,0,0,0,0,0,0,0,0,0,0,1.7,30000000.0,22.0,2003-04-04,2026-06-30,4.862023653088042
Aston Villa,Emiliano Buendía,25/12/1996 (29),Argentina  Spain,right,Midfield - Attacking Midfield,01/07/2021,30/06/2027,31,7,0,5,4,0,13,17,0,0,1.512',21,5,0,2,2,0,10,12,0,0,935',0,0,0,0,0,0,0,0,0,0,0,1,1,0,1,1,0,0,0,0,0,90',1.72,18000000.0,29.0,1996-12-25,2027-06-30,16.852825229960576
Aston Villa,Jadon Sancho,25/03/2000 (25),England  Jamaica,right,Attack - Left Winger,01/09/2025,30/06/2026,21,1,0,0,0,0,11,10,0,0,944',12,0,0,0,0,0,9,4,0,0,364',0,0,0,0,0,0,0,0,0,0,0,1,0,0,0,0,0,1,0,0,0,25',1.8,20000000.0,25.0,2000-03-25,2026-06-30,4.862023653088042
Aston Villa,Leon Bailey,09/08/1997 (28),Jamaica,left,Attack - Right Winger,04/08/2021,30/06/2027,12,0,0,2,0,0,10,4,0,0,348',1,0,0,0,0,0,1,0,0,0,31',0,0,0,0,0,0,0,0,0,0,0,0,0,0,0,0,0,0,0,0,0,0,1.78,18000000.0,28.0,1997-08-09,2027-06-30,16.852825229960576
Aston Villa,Alysson,05/05/2006 (19),Brazil,left,Attack - Right Winger,01/01/2026,-,64,8,0,7,7,0,20,41,0,0,3.542',0,0,0,0,0,0,0,0,0,0,0,0,0,0,0,0,0,0,0,0,0,0,0,0,0,0,0,0,0,0,0,0,0,1.84,8000000.0,19.0,2006-05-05,,0.0
Aston Villa,Ollie Watkins,30/12/1995 (30),England,right,Attack - Centre-Forward,09/09/2020,30/06/2028,33,8,0,1,1,0,9,14,0,0,2.176',23,8,0,1,1,0,3,11,0,0,1.751',0,0,0,0,0,0,0,0,0,0,0,1,0,0,0,0,0,1,0,0,0,25',1.8,30000000.0,30.0,1995-12-30,2028-06-30,28.876478318002626
Aston Villa,Tammy Abraham,02/10/1997 (28),England  Nigeria,right,Attack - Centre-Forward,27/01/2026,30/06/2030,26,13,0,3,5,0,3,14,0,0,1.880',0,0,0,0,0,0,0,0,0,0,0,0,0,0,0,0,0,0,0,0,0,0,0,0,0,0,0,0,0,0,0,0,0,1.94,14000000.0,28.0,1997-10-02,2030-06-30,52.858081471747695
Brighton & Hove Albion,Bart Verbruggen,18/08/2002 (23),Netherlands,right,Goalkeeper,03/07/2023,30/06/2028,24,0,1,0,3,0,0,0,5,32,2.160',24,0,1,0,3,0,0,0,32,5,2.160',0,0,0,0,0,0,0,0,0,0,0,0,0,0,0,0,0,0,0,0,0,0,1.94,35000000.0,23.0,2002-08-18,2028-06-30,28.876478318002626
Brighton & Hove Albion,Jason Steele,18/08/1990 (35),England,right,Goalkeeper,01/07/2018,30/06/2027,4,0,0,0,0,0,0,0,2,3,360',0,0,0,0,0,0,0,0,0,0,0,0,0,0,0,0,0,0,0,0,0,0,1,0,0,0,0,0,0,0,0,1,90',1.88,750000.0,35.0,1990-08-18,2027-06-30,16.852825229960576
Brighton & Hove Albion,Tom McGill,25/03/2000 (25),Canada  England,right,Goalkeeper,29/07/2022,30/06/2027,1,0,0,0,0,0,0,1,1,0,34',0,0,0,0,0,0,0,0,0,0,0,0,0,0,0,0,0,0,0,0,0,0,0,0,0,0,0,0,0,0,0,0,0,1.85,500000.0,25.0,2000-03-25,2027-06-30,16.852825229960576
Brighton & Hove Albion,Jan Paul van Hecke,08/06/2000 (25),Netherlands,right,Defender - Centre-Back,10/09/2020,30/06/2027,26,3,1,2,6,0,2,0,0,0,2.198',23,3,1,2,6,0,0,0,0,0,2.070',0,0,0,0,0,0,0,0,0,0,0,1,0,0,0,0,0,1,0,0,0,13',1.89,35000000.0,25.0,2000-06-08,2027-06-30,16.852825229960576
Brighton & Hove Albion,Olivier Boscagli,18/11/1997 (28),France  Monaco,left,Defender - Centre-Back,02/07/2025,30/06/2030,9,1,0,1,2,0,2,2,0,0,591',5,0,0,1,1,0,2,2,0,0,231',0,0,0,0,0,0,0,0,0,0,0,1,0,0,0,0,0,0,0,0,0,90',1.81,18000000.0,28.0,1997-11-18,2030-06-30,52.858081471747695
Brighton & Hove Albion,Igor Julio,07/02/1998 (27),Brazil,left,Defender - Centre-Back,26/07/2023,30/06/2027,5,0,0,0,0,0,3,0,0,0,193',4,0,0,0,0,0,3,0,0,0,103',0,0,0,0,0,0,0,0,0,0,0,0,0,0,0,0,0,0,0,0,0,0,1.88,15000000.0,27.0,1998-02-07,2027-06-30,16.852825229960576
Brighton & Hove Albion,Adam Webster,04/01/1995 (31),England,right,Defender - Centre-Back,03/08/2019,30/06/2026,365,17,5,12,38,1,48,38,0,0,28.278',138,6,3,1,18,0,15,17,0,0,10.715',0,0,0,0,0,0,0,0,0,0,0,23,0,1,1,3,0,4,3,0,0,1.850',1.9,7000000.0,31.0,1995-01-04,2026-06-30,4.862023653088042
Brighton & Hove Albion,Lewis Dunk,21/11/1991 (34),England,right,Defender - Centre-Back,01/07/2010,30/06/2027,23,0,0,0,8,0,1,0,0,0,2.025',23,0,0,0,8,0,1,0,0,0,2.025',0,0,0,0,0,0,0,0,0,0,0,0,0,0,0,0,0,0,0,0,0,0,1.92,4000000.0,34.0,1991-11-21,2027-06-30,16.852825229960576
Brighton & Hove Albion,Ferdi Kadıoğlu,07/10/1999 (26),Türkiye  Netherlands,right,Defender - Left-Back,24/08/2024,30/06/2028,27,0,0,0,5,0,3,6,0,0,2.166',23,0,0,0,4,0,3,4,0,0,1.874',0,0,0,0,0,0,0,0,0,0,0,1,0,0,0,0,0,0,0,0,0,90',1.74,28000000.0,26.0,1999-10-07,2028-06-30,28.876478318002626
Brighton & Hove Albion,Maxim De Cuyper,22/12/2000 (25),Belgium,left,Defender - Left-Back,05/07/2025,30/06/2030,21,2,0,0,2,0,7,10,0,0,1.121',20,2,0,0,2,0,7,9,0,0,1.054',0,0,0,0,0,0,0,0,0,0,0,0,0,0,0,0,0,0,0,0,0,0,1.82,22000000.0,25.0,2000-12-22,2030-06-30,52.858081471747695
Brighton & Hove Albion,Joël Veltman,15/01/1992 (34),Netherlands,right,Defender - Right-Back,29/07/2020,30/06/2026,16,1,0,1,3,0,6,4,0,0,914',13,1,0,0,3,0,6,1,0,0,694',0,0,0,0,0,0,0,0,0,0,0,1,0,0,0,0,0,0,1,0,0,77',1.84,2500000.0,34.0,1992-01-15,2026-06-30,4.862023653088042
Brighton & Hove Albion,Carlos Baleba,03/01/2004 (22),Cameroon,left,Midfield - Defensive Midfield,29/08/2023,30/06/2028,22,0,0,0,5,0,4,15,0,0,1.265',19,0,0,0,4,0,3,14,0,0,1.098',0,0,0,0,0,0,0,0,0,0,0,0,0,0,0,0,0,0,0,0,0,0,1.79,60000000.0,22.0,2004-01-03,2028-06-30,28.876478318002626
Brighton & Hove Albion,Mats Wieffer,16/11/1999 (26),Netherlands,right,Midfield - Defensive Midfield,05/07/2024,30/06/2029,17,0,0,3,4,0,4,4,0,0,1.205',16,0,0,3,4,0,3,4,0,0,1.182',0,0,0,0,0,0,0,0,0,0,0,0,0,0,0,0,0,0,0,0,0,0,1.88,25000000.0,26.0,1999-11-16,2029-06-30,40.86727989487516
Brighton & Hove Albion,Jack Hinshelwood,11/04/2005 (20),England,right,Midfield - Defensive Midfield,01/07/2023,30/06/2028,15,1,0,2,0,0,6,7,0,0,817',13,1,0,2,0,0,6,6,0,0,661',0,0,0,0,0,0,0,0,0,0,0,1,0,0,0,0,0,0,0,0,0,90',1.82,22000000.0,20.0,2005-04-11,2028-06-30,28.876478318002626
Brighton & Hove Albion,Yasin Ayari,06/10/2003 (22),Sweden  Tunisia,right,Midfield - Central Midfield,30/01/2023,30/06/2027,24,4,0,2,0,0,6,4,0,0,1.797',21,3,0,2,0,0,3,4,0,0,1.702',0,0,0,0,0,0,0,0,0,0,0,1,0,0,0,0,0,1,0,0,0,13',1.72,30000000.0,22.0,2003-10-06,2027-06-30,16.852825229960576
Brighton & Hove Albion,Diego Gómez,27/03/2003 (22),Paraguay,right,Midfield - Central Midfield,01/01/2025,-,25,8,0,0,5,0,4,19,0,0,1.714',21,3,0,0,5,0,4,15,0,0,1.428',0,0,0,0,0,0,0,0,0,0,0,1,0,0,0,0,0,0,1,0,0,77',1.85,25000000.0,22.0,2003-03-27,,0.0
Brighton & Hove Albion,Pascal Groß,15/06/1991 (34),Germany,right,Midfield - Central Midfield,02/01/2026,30/06/2027,22,1,0,2,2,0,9,9,0,0,1.199',5,1,0,0,2,0,1,2,0,0,377',3,0,0,1,0,0,3,0,0,0,37',1,0,0,0,0,0,0,0,0,0,90',1.81,3500000.0,34.0,1991-06-15,2027-06-30,16.852825229960576
Brighton & Hove Albion,James Milner,04/01/1986 (40),England,right,Midfield - Central Midfield,01/07/2023,30/06/2026,16,1,0,1,2,0,12,3,0,0,477',14,1,0,1,2,0,12,2,0,0,309',0,0,0,0,0,0,0,0,0,0,0,0,0,0,0,0,0,0,0,0,0,0,1.75,750000.0,40.0,1986-01-04,2026-06-30,4.862023653088042
Brighton & Hove Albion,Andrew Moran,15/10/2003 (22),Ireland,right,Midfield - Attacking Midfield,01/07/2025,30/06/2028,173,39,0,38,26,0,51,51,0,0,11.390',1,0,0,0,0,0,1,0,0,0,12',0,0,0,0,0,0,0,0,0,0,0,4,0,0,0,2,0,0,1,0,0,363',1.77,3500000.0,22.0,2003-10-15,2028-06-30,28.876478318002626
Brighton & Hove Albion,Kaoru Mitoma,20/05/1997 (28),Japan,right,Attack - Left Winger,10/08/2021,30/06/2027,15,2,0,1,2,0,4,4,0,0,1.029',14,2,0,1,2,0,3,4,0,0,1.017',0,0,0,0,0,0,0,0,0,0,0,1,0,0,0,0,0,1,0,0,0,12',1.78,30000000.0,28.0,1997-05-20,2027-06-30,16.852825229960576
Brighton & Hove Albion,Tom Watson,08/04/2006 (19),England,right,Attack - Left Winger,01/07/2025,30/06/2029,10,1,0,3,1,0,9,0,0,0,193',6,0,0,0,1,0,6,0,0,0,56',0,0,0,0,0,0,0,0,0,0,0,1,0,0,0,0,0,1,0,0,0,1',1.9,10000000.0,19.0,2006-04-08,2029-06-30,40.86727989487516
Brighton & Hove Albion,Yankuba Minteh,22/07/2004 (21),The Gambia,left,Attack - Right Winger,01/07/2024,30/06/2029,23,1,0,4,0,0,5,10,0,0,1.637',22,1,0,4,0,0,4,10,0,0,1.614',0,0,0,0,0,0,0,0,0,0,0,0,0,0,0,0,0,0,0,0,0,0,1.8,40000000.0,21.0,2004-07-22,2029-06-30,40.86727989487516
Brighton & Hove Albion,Brajan Gruda,31/05/2004 (21),Germany  Albania,left,Attack - Right Winger,14/08/2024,30/06/2028,20,3,0,3,2,0,10,9,0,0,896',18,1,0,1,2,0,10,8,0,0,716',0,0,0,0,0,0,0,0,0,0,0,1,1,0,1,0,0,0,1,0,0,90',1.78,28000000.0,21.0,2004-05-31,2028-06-30,28.876478318002626
Brighton & Hove Albion,Solly March,20/07/1994 (31),England,left,Attack - Right Winger,01/07/2013,30/06/2026,306,28,1,32,18,0,107,92,0,0,18.473',190,14,0,20,12,0,56,60,0,0,12.326',0,0,0,0,0,0,0,0,0,0,0,23,5,1,3,0,0,8,5,0,0,1.590',1.8,3000000.0,31.0,1994-07-20,2026-06-30,4.862023653088042
Brighton & Hove Albion,Georginio Rutter,20/04/2002 (23),France  Martinique,left,Attack - Centre-Forward,19/08/2024,30/06/2028,24,2,1,3,2,0,5,16,0,0,1.584',22,2,1,3,2,0,5,14,0,0,1.434',0,0,0,0,0,0,0,0,0,0,0,1,0,0,0,0,0,0,1,0,0,83',1.82,32000000.0,23.0,2002-04-20,2028-06-30,28.876478318002626
Brighton & Hove Albion,Charalampos Kostoulas,30/05/2007 (18),Greece,right,Attack - Centre-Forward,01/07/2025,30/06/2030,19,3,0,1,3,0,17,2,0,0,320',14,2,0,1,2,0,13,1,0,0,203',0,0,0,0,0,0,0,0,0,0,0,1,0,0,0,1,0,1,0,0,0,7',1.85,25000000.0,18.0,2007-05-30,2030-06-30,52.858081471747695
Brighton & Hove Albion,Stefanos Tzimas,06/01/2006 (20),Greece,both,Attack - Centre-Forward,03/02/2025,30/06/2030,13,3,0,2,1,0,10,2,0,0,339',9,1,0,1,0,0,8,1,0,0,132',0,0,0,0,0,0,0,0,0,0,0,0,0,0,0,0,0,0,0,0,0,0,1.86,22000000.0,20.0,2006-01-06,2030-06-30,52.858081471747695
Brighton & Hove Albion,Danny Welbeck,26/11/1990 (35),England  Ghana,right,Attack - Centre-Forward,18/10/2020,30/06/2026,26,9,0,1,4,0,9,11,0,0,1.536',23,8,0,0,4,0,8,10,0,0,1.355',0,0,0,0,0,0,0,0,0,0,0,1,1,0,0,0,0,0,1,0,0,78',1.85,4000000.0,35.0,1990-11-26,2026-06-30,4.862023653088042
Crystal Palace,Dean Henderson,12/03/1997 (28),England,right,Goalkeeper,31/08/2023,30/06/2028,30,0,0,0,2,0,0,0,11,34,2.700',23,0,0,0,2,0,0,0,28,8,2.070',0,0,0,0,0,0,0,0,0,0,0,0,0,0,0,0,0,0,0,0,0,0,1.88,28000000.0,28.0,1997-03-12,2028-06-30,28.876478318002626
Crystal Palace,Walter Benítez,19/01/1993 (33),Argentina  France,right,Goalkeeper,01/07/2025,-,6,0,0,0,0,0,0,0,2,6,540',0,0,0,0,0,0,0,0,0,0,0,0,0,0,0,0,0,0,0,0,0,0,1,0,0,0,0,0,0,0,0,2,90',1.91,5000000.0,33.0,1993-01-19,,0.0
Crystal Palace,Remi Matthews,10/02/1994 (31),England,right,Goalkeeper,12/07/2021,30/06/2027,0,0,0,0,0,0,0,0,0,0,0,0,0,0,0,0,0,0,0,0,0,0,0,0,0,0,0,0,0,0,0,0,0,0,0,0,0,0,0,0,0,0,0,0,1.92,300000.0,31.0,1994-02-10,2027-06-30,16.852825229960576
Crystal Palace,Maxence Lacroix,06/04/2000 (25),France  Guadeloupe,right,Defender - Centre-Back,30/08/2024,30/06/2029,34,1,1,2,4,0,0,0,0,0,3.060',23,0,0,2,3,0,0,0,0,0,2.070',0,0,0,0,0,0,0,0,0,0,0,0,0,0,0,0,0,0,0,0,0,0,1.9,35000000.0,25.0,2000-04-06,2029-06-30,40.86727989487516
Crystal Palace,Chris Richards,28/03/2000 (25),United States,right,Defender - Centre-Back,27/07/2022,30/06/2027,28,2,0,0,1,0,2,2,0,0,2.392',19,1,0,0,1,0,0,1,0,0,1.703',0,0,0,0,0,0,0,0,0,0,0,1,0,0,0,0,0,0,0,0,0,90',1.88,25000000.0,25.0,2000-03-28,2027-06-30,16.852825229960576
Crystal Palace,Jaydee Canvot,29/07/2006 (19),France  Senegal,right,Defender - Centre-Back,01/09/2025,30/06/2029,18,0,0,0,3,0,6,4,0,0,1.044',9,0,0,0,1,0,6,1,0,0,354',0,0,0,0,0,0,0,0,0,0,0,1,0,0,0,0,0,0,1,0,0,45',1.88,20000000.0,19.0,2006-07-29,2029-06-30,40.86727989487516
Crystal Palace,Chadi Riad,17/06/2003 (22),Morocco  Spain,left,Defender - Centre-Back,02/07/2024,30/06/2029,3,1,0,1,1,0,1,2,0,0,131',1,0,0,1,0,0,1,0,0,0,14',0,0,0,0,0,0,0,0,0,0,0,0,0,0,0,0,0,0,0,0,0,0,1.87,12000000.0,22.0,2003-06-17,2029-06-30,40.86727989487516
Crystal Palace,Tyrick Mitchell,01/09/1999 (26),England  Jamaica,left,Defender - Left-Back,01/07/2020,30/06/2027,31,2,0,1,5,0,3,5,0,0,2.563',23,1,0,0,5,0,0,3,0,0,2.040',0,0,0,0,0,0,0,0,0,0,0,1,0,0,0,0,0,1,0,0,0,45',1.81,25000000.0,26.0,1999-09-01,2027-06-30,16.852825229960576
Crystal Palace,Borna Sosa,21/01/1998 (28),Croatia  Germany,left,Defender - Left-Back,11/07/2025,30/06/2028,15,0,0,0,3,0,7,4,0,0,706',5,0,0,0,0,0,5,0,0,0,53',0,0,0,0,0,0,0,0,0,0,0,1,0,0,0,1,0,0,0,0,0,90',1.87,4000000.0,28.0,1998-01-21,2028-06-30,28.876478318002626
Crystal Palace,Rio Cardines,01/07/2006 (19),Trinidad and Tobago  England,left,Defender - Left-Back,01/07/2025,-,5,0,0,0,1,0,2,2,0,0,198',0,0,0,0,0,0,0,0,0,0,0,0,0,0,0,0,0,0,0,0,0,0,0,0,0,0,0,0,0,0,0,0,0,0.0,300000.0,19.0,2006-07-01,,0.0
Crystal Palace,Daniel Muñoz,26/05/1996 (29),Colombia,right,Defender - Right-Back,30/01/2024,30/06/2028,24,4,0,2,4,0,0,5,0,0,2.124',15,3,0,2,4,0,0,2,0,0,1.336',0,0,0,0,0,0,0,0,0,0,0,0,0,0,0,0,0,0,0,0,0,0,1.81,27000000.0,29.0,1996-05-26,2028-06-30,28.876478318002626
Crystal Palace,Caleb Kporha,15/07/2006 (19),England  Ghana,right,Defender - Right-Back,01/07/2024,30/06/2029,1,0,0,0,0,0,0,1,0,0,45',0,0,0,0,0,0,0,0,0,0,0,0,0,0,0,0,0,0,0,0,0,0,0,0,0,0,0,0,0,0,0,0,0,0.0,1000000.0,19.0,2006-07-15,2029-06-30,40.86727989487516
Crystal Palace,Nathaniel Clyne,05/04/1991 (34),England  Grenada,right,Defender - Right-Back,14/10/2020,30/06/2026,10,0,0,1,0,0,4,6,0,0,495',7,0,0,1,0,0,1,6,0,0,423',0,0,0,0,0,0,0,0,0,0,0,0,0,0,0,0,0,0,0,0,0,0,1.75,500000.0,34.0,1991-04-05,2026-06-30,4.862023653088042
Crystal Palace,Adam Wharton,06/02/2004 (21),England,left,Midfield - Defensive Midfield,01/02/2024,30/06/2029,31,0,0,3,3,0,3,12,0,0,2.417',21,0,0,2,3,0,0,10,0,0,1.734',0,0,0,0,0,0,0,0,0,0,0,1,0,0,0,0,0,0,0,0,0,90',1.82,60000000.0,21.0,2004-02-06,2029-06-30,40.86727989487516
Crystal Palace,Cheick Doucouré,08/01/2000 (26),Mali,right,Midfield - Defensive Midfield,11/07/2022,30/06/2029,197,8,0,10,36,1,23,60,0,0,15.122',58,0,0,3,11,0,9,24,0,0,4.153',0,0,0,0,0,0,0,0,0,0,0,1,0,0,0,0,0,0,1,0,0,64',1.8,15000000.0,26.0,2000-01-08,2029-06-30,40.86727989487516
Crystal Palace,Jefferson Lerma,25/10/1994 (31),Colombia,right,Midfield - Defensive Midfield,01/07/2023,30/06/2026,32,0,0,4,5,0,16,5,0,0,1.633',20,0,0,2,5,0,11,2,0,0,933',0,0,0,0,0,0,0,0,0,0,0,0,0,0,0,0,0,0,0,0,0,0,1.79,8000000.0,31.0,1994-10-25,2026-06-30,4.862023653088042
Crystal Palace,Will Hughes,17/04/1995 (30),England,left,Midfield - Central Midfield,28/08/2021,30/06/2027,32,0,0,1,6,0,14,10,0,0,1.656',20,0,0,0,4,0,9,5,0,0,974',0,0,0,0,0,0,0,0,0,0,0,1,0,0,0,0,0,1,0,0,0,45',1.85,6000000.0,30.0,1995-04-17,2027-06-30,16.852825229960576
Crystal Palace,Daichi Kamada,05/08/1996 (29),Japan,right,Midfield - Attacking Midfield,01/07/2024,30/06/2026,23,0,0,2,2,0,3,14,0,0,1.639',14,0,0,1,1,0,0,10,0,0,1.174',0,0,0,0,0,0,0,0,0,0,0,0,0,0,0,0,0,0,0,0,0,0,1.8,12000000.0,29.0,1996-08-05,2026-06-30,4.862023653088042
Crystal Palace,Justin Devenny,11/10/2003 (22),Northern Ireland  Scotland,left,Midfield - Attacking Midfield,01/07/2024,30/06/2027,29,2,0,1,0,0,20,7,0,0,1.039',18,1,0,0,0,0,13,4,0,0,597',0,0,0,0,0,0,0,0,0,0,0,1,0,0,0,0,0,0,1,0,0,69',1.84,8000000.0,22.0,2003-10-11,2027-06-30,16.852825229960576
Crystal Palace,Ismaïla Sarr,25/02/1998 (27),Senegal,right,Attack - Right Winger,01/08/2024,30/06/2029,21,8,0,2,2,0,1,6,0,0,1.697',13,3,0,1,1,0,0,3,0,0,1.102',0,0,0,0,0,0,0,0,0,0,0,0,0,0,0,0,0,0,0,0,0,0,1.85,35000000.0,27.0,1998-02-25,2029-06-30,40.86727989487516
Crystal Palace,Yéremy Pino,20/10/2002 (23),Spain,right,Attack - Right Winger,29/08/2025,30/06/2030,32,5,0,5,4,0,3,22,0,0,2.320',21,2,0,1,3,0,3,15,0,0,1.475',0,0,0,0,0,0,0,0,0,0,0,1,1,0,0,0,0,0,0,0,0,90',1.72,35000000.0,23.0,2002-10-20,2030-06-30,52.858081471747695
Crystal Palace,Brennan Johnson,23/05/2001 (24),Wales  England,right,Attack - Right Winger,02/01/2026,30/06/2030,27,4,0,0,4,1,13,9,0,0,1.285',20,2,0,0,4,0,10,7,0,0,934',4,1,0,0,0,1,2,1,0,0,151',1,0,0,0,0,0,1,0,0,0,45',1.86,35000000.0,24.0,2001-05-23,2030-06-30,52.858081471747695
Crystal Palace,Evann Guessand,01/07/2001 (24),Cote d'Ivoire  France,right,Attack - Right Winger,30/01/2026,30/06/2026,21,2,0,0,2,0,8,8,0,0,1.207',13,0,0,0,0,0,7,6,0,0,588',0,0,0,0,0,0,0,0,0,0,0,0,0,0,0,0,0,0,0,0,0,0,1.88,28000000.0,24.0,2001-07-01,2026-06-30,4.862023653088042
Crystal Palace,Jesurun Rak-Sakyi,05/10/2002 (23),England  Ghana,left,Attack - Right Winger,01/07/2022,30/06/2027,13,4,0,1,1,0,2,10,0,0,850',0,0,0,0,0,0,0,0,0,0,0,0,0,0,0,0,0,0,0,0,0,0,0,0,0,0,0,0,0,0,0,0,0,1.78,6000000.0,23.0,2002-10-05,2027-06-30,16.852825229960576
Crystal Palace,Jean-Philippe Mateta,28/06/1997 (28),France  DR Congo,right,Attack - Centre-Forward,31/01/2022,30/06/2027,34,10,0,2,4,0,2,14,0,0,2.707',23,8,0,0,2,0,0,11,0,0,1.915',0,0,0,0,0,0,0,0,0,0,0,0,0,0,0,0,0,0,0,0,0,0,1.92,40000000.0,28.0,1997-06-28,2027-06-30,16.852825229960576
Crystal Palace,Eddie Nketiah,30/05/1999 (26),England  Ghana,right,Attack - Centre-Forward,30/08/2024,30/06/2029,19,4,0,1,3,0,14,5,0,0,690',12,2,0,0,2,0,10,2,0,0,416',0,0,0,0,0,0,0,0,0,0,0,0,0,0,0,0,0,0,0,0,0,0,1.75,16000000.0,26.0,1999-05-30,2029-06-30,40.86727989487516
Crystal Palace,Christantus Uche,19/05/2003 (22),Nigeria,both,Attack - Centre-Forward,01/09/2025,30/06/2026,23,3,0,2,1,0,16,2,0,0,748',11,0,0,1,0,0,11,0,0,0,114',0,0,0,0,0,0,0,0,0,0,0,1,0,0,0,0,0,0,0,0,0,90',1.9,15000000.0,22.0,2003-05-19,2026-06-30,4.862023653088042
AFC Bournemouth,Djordje Petrovic,08/10/1999 (26),Serbia,right,Goalkeeper,16/07/2025,30/06/2030,26,0,1,0,3,0,0,0,6,48,2.370',24,0,1,0,2,0,0,0,43,6,2.160',0,0,0,0,0,0,0,0,0,0,0,1,0,0,0,1,0,0,0,0,3,120',1.94,28000000.0,26.0,1999-10-08,2030-06-30,52.858081471747695
AFC Bournemouth,Christos Mandas,17/09/2001 (24),Greece,right,Goalkeeper,27/01/2026,30/06/2026,1,0,0,0,0,0,0,0,1,0,90',0,0,0,0,0,0,0,0,0,0,0,0,0,0,0,0,0,0,0,0,0,0,0,0,0,0,0,0,0,0,0,0,0,1.89,5000000.0,24.0,2001-09-17,2026-06-30,4.862023653088042
AFC Bournemouth,Fraser Forster,17/03/1988 (37),England,right,Goalkeeper,02/01/2026,30/06/2026,0,0,0,0,0,0,0,0,0,0,0,0,0,0,0,0,0,0,0,0,0,0,0,0,0,0,0,0,0,0,0,0,0,0,0,0,0,0,0,0,0,0,0,0,2.01,600000.0,37.0,1988-03-17,2026-06-30,4.862023653088042
AFC Bournemouth,Will Dennis,10/07/2000 (25),England,right,Goalkeeper,01/07/2021,30/06/2028,0,0,0,0,0,0,0,0,0,0,0,0,0,0,0,0,0,0,0,0,0,0,0,0,0,0,0,0,0,0,0,0,0,0,0,0,0,0,0,0,0,0,0,0,1.88,350000.0,25.0,2000-07-10,2028-06-30,28.876478318002626
AFC Bournemouth,Bafodé Diakité,06/01/2001 (25),France  Guinea,right,Defender - Centre-Back,13/08/2025,-,20,0,0,0,1,0,3,3,0,0,1.440',18,0,0,0,1,0,3,2,0,0,1.275',0,0,0,0,0,0,0,0,0,0,0,1,0,0,0,0,0,0,0,0,0,120',1.84,35000000.0,25.0,2001-01-06,,0.0
AFC Bournemouth,Marcos Senesi,10/05/1997 (28),Argentina  Italy,left,Defender - Centre-Back,08/08/2022,30/06/2026,25,0,0,4,7,0,2,2,0,0,2.106',23,0,0,4,7,0,0,2,0,0,2.030',0,0,0,0,0,0,0,0,0,0,0,1,0,0,0,0,0,1,0,0,0,31',1.85,22000000.0,28.0,1997-05-10,2026-06-30,4.862023653088042
AFC Bournemouth,Veljko Milosavljevic,28/06/2007 (18),Serbia,right,Defender - Centre-Back,01/09/2025,30/06/2030,15,0,0,0,0,0,5,0,0,0,984',7,0,0,0,0,0,3,0,0,0,367',0,0,0,0,0,0,0,0,0,0,0,0,0,0,0,0,0,0,0,0,0,0,1.92,20000000.0,18.0,2007-06-28,2030-06-30,52.858081471747695
AFC Bournemouth,James Hill,10/01/2002 (24),England,right,Defender - Centre-Back,05/01/2022,30/06/2029,17,0,0,1,2,0,7,2,0,0,1.054',15,0,0,1,2,0,7,2,0,0,844',0,0,0,0,0,0,0,0,0,0,0,1,0,0,0,0,0,0,0,0,0,120',1.84,7000000.0,24.0,2002-01-10,2029-06-30,40.86727989487516
AFC Bournemouth,Matai Akinmboni,17/10/2006 (19),United States  Nigeria,left,Defender - Centre-Back,03/01/2025,30/06/2026,1,0,0,0,0,0,0,1,0,0,45',0,0,0,0,0,0,0,0,0,0,0,0,0,0,0,0,0,0,0,0,0,0,0,0,0,0,0,0,0,0,0,0,0,1.88,1000000.0,19.0,2006-10-17,2026-06-30,4.862023653088042
AFC Bournemouth,Adrien Truffert,20/11/2001 (24),France,left,Defender - Left-Back,01/07/2025,30/06/2030,25,0,0,1,3,0,1,2,0,0,2.157',24,0,0,1,3,0,0,2,0,0,2.120',0,0,0,0,0,0,0,0,0,0,0,1,0,0,0,0,0,1,0,0,0,37',1.76,20000000.0,24.0,2001-11-20,2030-06-30,52.858081471747695
AFC Bournemouth,Julio Soler,16/02/2005 (20),Argentina  Paraguay,left,Defender - Left-Back,07/01/2025,30/06/2029,5,0,0,0,1,0,3,1,0,0,207',3,0,0,0,0,0,3,0,0,0,34',0,0,0,0,0,0,0,0,0,0,0,1,0,0,0,1,0,0,1,0,0,83',1.75,8000000.0,20.0,2005-02-16,2029-06-30,40.86727989487516
AFC Bournemouth,Álex Jiménez,08/05/2005 (20),Spain,right,Defender - Right-Back,01/09/2025,30/06/2026,22,1,0,1,7,0,6,11,0,0,1.513',20,1,0,0,6,0,4,11,0,0,1.419',0,0,0,0,0,0,0,0,0,0,0,1,0,0,1,0,0,1,0,0,0,49',1.77,18000000.0,20.0,2005-05-08,2026-06-30,4.862023653088042
AFC Bournemouth,Adam Smith,29/04/1991 (34),England,right,Defender - Right-Back,28/01/2014,30/06/2026,14,0,0,1,2,0,3,6,0,0,845',13,0,0,1,2,0,3,6,0,0,725',0,0,0,0,0,0,0,0,0,0,0,1,0,0,0,0,0,0,0,0,0,120',1.74,500000.0,34.0,1991-04-29,2026-06-30,4.862023653088042
AFC Bournemouth,Tyler Adams,14/02/1999 (26),United States,right,Midfield - Defensive Midfield,20/08/2023,30/06/2028,16,2,0,1,5,0,1,8,0,0,1.219',15,2,0,1,5,0,0,8,0,0,1.203',0,0,0,0,0,0,0,0,0,0,0,0,0,0,0,0,0,0,0,0,0,0,1.75,25000000.0,26.0,1999-02-14,2028-06-30,28.876478318002626
AFC Bournemouth,Alex Scott,21/08/2003 (22),England  Guernsey,right,Midfield - Central Midfield,10/08/2023,30/06/2028,26,3,0,1,3,0,3,15,0,0,1.892',24,2,0,1,2,0,3,14,0,0,1.690',0,0,0,0,0,0,0,0,0,0,0,1,1,0,0,1,0,0,1,0,0,112',1.78,30000000.0,22.0,2003-08-21,2028-06-30,28.876478318002626
AFC Bournemouth,Lewis Cook,03/02/1997 (28),England,right,Midfield - Central Midfield,08/07/2016,30/06/2028,15,0,0,1,2,1,7,0,0,0,890',14,0,0,1,1,1,7,0,0,0,770',0,0,0,0,0,0,0,0,0,0,0,1,0,0,0,1,0,0,0,0,0,120',1.75,13000000.0,28.0,1997-02-03,2028-06-30,28.876478318002626
AFC Bournemouth,Ryan Christie,22/02/1995 (30),Scotland,left,Midfield - Central Midfield,31/08/2021,30/06/2027,15,1,0,0,1,0,13,2,0,0,425',14,1,0,0,1,0,13,1,0,0,351',0,0,0,0,0,0,0,0,0,0,0,0,0,0,0,0,0,0,0,0,0,0,1.78,9000000.0,30.0,1995-02-22,2027-06-30,16.852825229960576
AFC Bournemouth,Alex Tóth,23/10/2005 (20),Hungary,right,Midfield - Central Midfield,20/01/2026,30/06/2031,27,2,0,5,4,0,8,6,0,0,1.812',2,0,0,0,0,0,2,0,0,0,9',0,0,0,0,0,0,0,0,0,0,0,0,0,0,0,0,0,0,0,0,0,0,1.81,8000000.0,20.0,2005-10-23,2031-06-30,64.84888304862024
AFC Bournemouth,Justin Kluivert,05/05/1999 (26),Netherlands  Suriname,both,Midfield - Attacking Midfield,01/07/2023,30/06/2028,19,2,0,0,4,0,8,11,0,0,988',18,2,0,0,4,0,8,10,0,0,922',0,0,0,0,0,0,0,0,0,0,0,0,0,0,0,0,0,0,0,0,0,0,1.72,32000000.0,26.0,1999-05-05,2028-06-30,28.876478318002626
AFC Bournemouth,Marcus Tavernier,22/03/1999 (26),England,left,Midfield - Attacking Midfield,01/08/2022,30/06/2029,23,6,0,3,4,0,3,11,0,0,1.818',22,5,0,3,3,0,2,11,0,0,1.769',0,0,0,0,0,0,0,0,0,0,0,1,1,0,0,1,0,1,0,0,0,49',1.78,20000000.0,26.0,1999-03-22,2029-06-30,40.86727989487516
AFC Bournemouth,Amine Adli,10/05/2000 (25),Morocco  France,left,Attack - Left Winger,21/08/2025,30/06/2030,23,2,0,3,4,0,14,7,0,0,875',20,2,0,2,2,0,14,5,0,0,669',0,0,0,0,0,0,0,0,0,0,0,1,0,0,0,0,0,0,1,0,0,71',1.8,20000000.0,25.0,2000-05-10,2030-06-30,52.858081471747695
AFC Bournemouth,Ben Gannon-Doak,11/11/2005 (20),Scotland,right,Attack - Right Winger,18/08/2025,30/06/2030,5,0,0,1,0,0,4,1,0,0,98',4,0,0,1,0,0,4,0,0,0,53',0,0,0,0,0,0,0,0,0,0,0,0,0,0,0,0,0,0,0,0,0,0,1.73,18000000.0,20.0,2005-11-11,2030-06-30,52.858081471747695
AFC Bournemouth,David Brooks,08/07/1997 (28),Wales  England,left,Attack - Right Winger,01/07/2018,30/06/2029,21,2,0,2,6,0,9,12,0,0,1.037',19,1,0,2,6,0,8,11,0,0,942',0,0,0,0,0,0,0,0,0,0,0,1,1,0,0,0,0,0,1,0,0,71',1.73,12000000.0,28.0,1997-07-08,2029-06-30,40.86727989487516
AFC Bournemouth,Evanilson,06/10/1999 (26),Brazil,both,Attack - Centre-Forward,16/08/2024,30/06/2029,24,5,0,2,1,0,5,13,0,0,1.797',22,5,0,1,1,0,3,13,0,0,1.681',0,0,0,0,0,0,0,0,0,0,0,1,0,0,1,0,0,1,0,0,0,92',1.83,40000000.0,26.0,1999-10-06,2029-06-30,40.86727989487516
AFC Bournemouth,Rayan,03/08/2006 (19),Brazil,left,Attack - Centre-Forward,27/01/2026,30/06/2031,2,2,0,1,0,0,1,1,0,0,107',1,0,0,1,0,0,1,0,0,0,22',0,0,0,0,0,0,0,0,0,0,0,0,0,0,0,0,0,0,0,0,0,0,1.85,25000000.0,19.0,2006-08-03,2031-06-30,64.84888304862024
AFC Bournemouth,Eli Kroupi,23/06/2006 (19),France  Cote d'Ivoire,right,Attack - Centre-Forward,03/02/2025,30/06/2030,21,8,0,0,3,0,9,12,0,0,937',19,8,0,0,3,0,9,10,0,0,781',0,0,0,0,0,0,0,0,0,0,0,1,0,0,0,0,0,0,1,0,0,90',1.79,22000000.0,19.0,2006-06-23,2030-06-30,52.858081471747695
AFC Bournemouth,Enes Ünal,10/05/1997 (28),Türkiye,right,Attack - Centre-Forward,01/07/2024,30/06/2028,12,1,0,0,1,0,11,1,0,0,145',11,1,0,0,1,0,11,0,0,0,117',0,0,0,0,0,0,0,0,0,0,0,1,0,0,0,0,0,0,1,0,0,28',1.87,8000000.0,28.0,1997-05-10,2028-06-30,28.876478318002626
Brentford FC,Caoimhín Kelleher,23/11/1998 (27),Ireland,right,Goalkeeper,01/07/2025,30/06/2030,23,0,0,0,1,0,0,0,5,32,2.070',23,0,0,0,1,0,0,0,32,5,2.070',0,0,0,0,0,0,0,0,0,0,0,0,0,0,0,0,0,0,0,0,0,0,1.88,22000000.0,27.0,1998-11-23,2030-06-30,52.858081471747695
Brentford FC,Hákon Valdimarsson,13/10/2001 (24),Iceland,right,Goalkeeper,26/01/2024,30/06/2028,6,0,0,0,0,0,0,0,3,4,540',0,0,0,0,0,0,0,0,0,0,0,0,0,0,0,0,0,0,0,0,0,0,1,0,0,0,0,0,0,0,1,0,90',1.95,2500000.0,24.0,2001-10-13,2028-06-30,28.876478318002626
Brentford FC,Ellery Balcombe,15/10/1999 (26),England  St. Vincent & Grenadinen,right,Goalkeeper,01/07/2018,30/06/2027,0,0,0,0,0,0,0,0,0,0,0,0,0,0,0,0,0,0,0,0,0,0,0,0,0,0,0,0,0,0,0,0,0,0,0,0,0,0,0,0,0,0,0,0,1.9,400000.0,26.0,1999-10-15,2027-06-30,16.852825229960576
Brentford FC,Nathan Collins,30/04/2001 (24),Ireland,right,Defender - Centre-Back,04/07/2023,30/06/2029,27,2,1,2,4,0,4,0,0,0,2.185',23,1,1,2,4,0,1,0,0,0,1.996',0,0,0,0,0,0,0,0,0,0,0,0,0,0,0,0,0,0,0,0,0,0,1.93,35000000.0,24.0,2001-04-30,2029-06-30,40.86727989487516
Brentford FC,Sepp van den Berg,20/12/2001 (24),Netherlands,right,Defender - Centre-Back,22/08/2024,30/06/2029,23,0,0,0,1,0,1,2,0,0,2.002',18,0,0,0,1,0,1,0,0,0,1.583',0,0,0,0,0,0,0,0,0,0,0,1,0,0,0,0,0,0,1,0,0,89',1.92,28000000.0,24.0,2001-12-20,2029-06-30,40.86727989487516
Brentford FC,Kristoffer Ajer,17/04/1998 (27),Norway,right,Defender - Centre-Back,21/07/2021,30/06/2030,20,0,0,2,1,0,4,6,0,0,1.331',17,0,0,1,1,0,4,5,0,0,1.099',0,0,0,0,0,0,0,0,0,0,0,0,0,0,0,0,0,0,0,0,0,0,1.98,16000000.0,27.0,1998-04-17,2030-06-30,52.858081471747695
Brentford FC,Ethan Pinnock,29/05/1993 (32),Jamaica  England,left,Defender - Centre-Back,02/07/2019,30/06/2027,6,0,1,0,1,0,0,4,0,0,471',3,0,1,0,1,0,0,3,0,0,231',0,0,0,0,0,0,0,0,0,0,0,1,0,0,0,0,0,0,0,0,0,90',1.94,4000000.0,32.0,1993-05-29,2027-06-30,16.852825229960576
Brentford FC,Rico Henry,08/07/1997 (28),Jamaica  England,left,Defender - Left-Back,31/08/2016,30/06/2026,24,0,0,0,2,0,11,7,0,0,1.290',19,0,0,0,2,0,11,5,0,0,864',0,0,0,0,0,0,0,0,0,0,0,1,0,0,0,0,0,0,1,0,0,80',1.7,15000000.0,28.0,1997-07-08,2026-06-30,4.862023653088042
Brentford FC,Michael Kayode,10/07/2004 (21),Italy  Nigeria,right,Defender - Right-Back,01/07/2025,30/06/2030,28,0,0,0,6,0,4,7,0,0,2.142',23,0,0,0,5,0,0,6,0,0,2.004',0,0,0,0,0,0,0,0,0,0,0,1,0,0,0,0,0,1,0,0,0,1',1.79,27000000.0,21.0,2004-07-10,2030-06-30,52.858081471747695
Brentford FC,Aaron Hickey,10/06/2002 (23),Scotland,both,Defender - Right-Back,09/07/2022,30/06/2028,19,1,0,0,1,0,10,7,0,0,784',15,0,0,0,1,0,9,5,0,0,542',0,0,0,0,0,0,0,0,0,0,0,1,0,0,0,0,0,0,0,0,0,90',1.85,16000000.0,23.0,2002-06-10,2028-06-30,28.876478318002626
Brentford FC,Vitaly Janelt,10/05/1998 (27),Germany  Bosnia-Herzegovina,left,Midfield - Defensive Midfield,03/10/2020,30/06/2030,22,0,0,4,4,0,11,3,0,0,1.142',18,0,0,4,4,0,9,2,0,0,940',0,0,0,0,0,0,0,0,0,0,0,1,0,0,0,0,0,1,0,0,0,45',1.84,18000000.0,27.0,1998-05-10,2030-06-30,52.858081471747695
Brentford FC,Jordan Henderson,17/06/1990 (35),England,right,Midfield - Defensive Midfield,15/07/2025,30/06/2027,22,1,0,3,4,0,6,8,0,0,1.410',21,1,0,3,4,0,6,7,0,0,1.365',0,0,0,0,0,0,0,0,0,0,0,1,0,0,0,0,0,0,1,0,0,45',1.82,2000000.0,35.0,1990-06-17,2027-06-30,16.852825229960576
Brentford FC,Yegor Yarmolyuk,01/03/2004 (21),Ukraine,right,Midfield - Central Midfield,01/07/2023,30/06/2031,26,1,0,2,5,0,4,12,0,0,1.881',23,1,0,2,5,0,2,11,0,0,1.744',0,0,0,0,0,0,0,0,0,0,0,0,0,0,0,0,0,0,0,0,0,0,1.8,25000000.0,21.0,2004-03-01,2031-06-30,64.84888304862024
Brentford FC,Mathias Jensen,01/01/1996 (30),Denmark,right,Midfield - Central Midfield,10/07/2019,30/06/2026,25,4,0,2,1,0,10,11,0,0,1.304',21,2,0,0,1,0,10,9,0,0,953',0,0,0,0,0,0,0,0,0,0,0,1,1,0,1,0,0,0,1,0,0,90',1.8,12000000.0,30.0,1996-01-01,2026-06-30,4.862023653088042
Brentford FC,Frank Onyeka,01/01/1998 (28),Nigeria,right,Midfield - Central Midfield,20/07/2021,30/06/2027,9,0,0,2,0,0,6,2,0,0,332',6,0,0,1,0,0,6,0,0,0,88',0,0,0,0,0,0,0,0,0,0,0,0,0,0,0,0,0,0,0,0,0,0,1.83,7000000.0,28.0,1998-01-01,2027-06-30,16.852825229960576
Brentford FC,Josh Dasilva,23/10/1998 (27),England  Angola,left,Midfield - Central Midfield,23/10/2025,30/06/2026,223,27,0,20,11,2,81,65,0,0,13.140',48,4,0,2,1,1,32,16,0,0,1.687',0,0,0,0,0,0,0,0,0,0,0,10,0,0,1,0,0,5,4,0,0,455',1.84,2500000.0,27.0,1998-10-23,2026-06-30,4.862023653088042
Brentford FC,Keane Lewis-Potter,22/02/2001 (24),England,right,Midfield - Left Midfield,12/07/2022,30/06/2031,24,4,0,2,1,0,12,7,0,0,1.122',21,2,0,1,1,0,11,7,0,0,928',0,0,0,0,0,0,0,0,0,0,0,1,1,0,0,0,0,0,0,0,0,90',1.7,22000000.0,24.0,2001-02-22,2031-06-30,64.84888304862024
Brentford FC,Mikkel Damsgaard,03/07/2000 (25),Denmark,right,Midfield - Attacking Midfield,10/08/2022,30/06/2030,23,1,0,3,0,0,6,11,0,0,1.475',20,1,0,3,0,0,5,11,0,0,1.283',0,0,0,0,0,0,0,0,0,0,0,1,0,0,0,0,0,0,0,0,0,90',1.8,30000000.0,25.0,2000-07-03,2030-06-30,52.858081471747695
Brentford FC,Antoni Milambo,03/04/2005 (20),Netherlands  DR Congo,right,Midfield - Attacking Midfield,03/07/2025,30/06/2030,3,0,0,0,0,0,0,3,0,0,172',1,0,0,0,0,0,0,1,0,0,45',0,0,0,0,0,0,0,0,0,0,0,0,0,0,0,0,0,0,0,0,0,0,1.79,20000000.0,20.0,2005-04-03,2030-06-30,52.858081471747695
Brentford FC,Fábio Carvalho,30/08/2002 (23),Portugal,right,Midfield - Attacking Midfield,12/08/2024,30/06/2029,10,5,0,1,1,0,5,1,0,0,455',6,1,0,0,0,0,5,0,0,0,100',0,0,0,0,0,0,0,0,0,0,0,0,0,0,0,0,0,0,0,0,0,0,1.7,12000000.0,23.0,2002-08-30,2029-06-30,40.86727989487516
Brentford FC,Kevin Schade,27/11/2001 (24),Germany  Nigeria,right,Attack - Left Winger,01/07/2023,30/06/2028,25,6,0,3,6,0,2,10,0,0,2.001',22,6,0,3,6,0,1,8,0,0,1.824',0,0,0,0,0,0,0,0,0,0,0,0,0,0,0,0,0,0,0,0,0,0,1.85,35000000.0,24.0,2001-11-27,2028-06-30,28.876478318002626
Brentford FC,Reiss Nelson,10/12/1999 (26),England  Jamaica,right,Attack - Left Winger,01/09/2025,30/06/2026,9,1,0,1,0,0,7,2,0,0,210',6,0,0,0,0,0,6,0,0,0,50',0,0,0,0,0,0,0,0,0,0,0,1,0,0,0,0,0,0,1,0,0,70',1.75,14000000.0,26.0,1999-12-10,2026-06-30,4.862023653088042
Brentford FC,Dango Ouattara,11/02/2002 (23),Burkina Faso,left,Attack - Right Winger,16/08/2025,30/06/2030,20,3,0,4,3,0,6,10,0,0,1.302',17,3,0,4,3,0,5,8,0,0,1.133',0,0,0,0,0,0,0,0,0,0,0,0,0,0,0,0,0,0,0,0,0,0,1.77,35000000.0,23.0,2002-02-11,2030-06-30,52.858081471747695
Brentford FC,Romelle Donovan,30/11/2006 (19),England  St. Kitts & Nevis,left,Attack - Right Winger,01/07/2025,30/06/2030,7,1,0,3,1,0,3,1,0,0,392',1,0,0,0,0,0,1,0,0,0,1',0,0,0,0,0,0,0,0,0,0,0,1,0,0,1,0,0,0,0,0,0,90',1.71,3500000.0,19.0,2006-11-30,2030-06-30,52.858081471747695
Brentford FC,Igor Thiago,26/06/2001 (24),Brazil  Bulgaria,right,Attack - Centre-Forward,01/07/2024,30/06/2029,24,17,0,1,5,0,2,7,0,0,1.967',23,16,0,1,4,0,1,7,0,0,1.937',0,0,0,0,0,0,0,0,0,0,0,0,0,0,0,0,0,0,0,0,0,0,1.91,35000000.0,24.0,2001-06-26,2029-06-30,40.86727989487516
Brentford FC,Kaye Furo,06/02/2007 (18),Belgium,right,Attack - Centre-Forward,11/01/2026,30/06/2031,19,1,0,1,0,0,7,8,0,0,1.041',0,0,0,0,0,0,0,0,0,0,0,1,0,0,0,0,0,1,0,0,0,23',0,0,0,0,0,0,0,0,0,0,0,1.9,2500000.0,18.0,2007-02-06,2031-06-30,64.84888304862024
Everton FC,Jordan Pickford,07/03/1994 (31),England,left,Goalkeeper,01/07/2017,30/06/2029,25,0,0,0,0,0,0,0,9,28,2.280',24,0,0,0,0,0,0,0,27,9,2.160',0,0,0,0,0,0,0,0,0,0,0,1,0,0,0,0,0,0,0,0,1,120',1.85,15000000.0,31.0,1994-03-07,2029-06-30,40.86727989487516
Everton FC,Mark Travers,18/05/1999 (26),Ireland,right,Goalkeeper,15/07/2025,30/06/2029,2,0,0,0,0,0,0,0,1,2,180',0,0,0,0,0,0,0,0,0,0,0,0,0,0,0,0,0,0,0,0,0,0,0,0,0,0,0,0,0,0,0,0,0,1.91,4000000.0,26.0,1999-05-18,2029-06-30,40.86727989487516
Everton FC,Tom King,09/03/1995 (30),Wales  England,right,Goalkeeper,15/08/2025,30/06/2027,0,0,0,0,0,0,0,0,0,0,0,0,0,0,0,0,0,0,0,0,0,0,0,0,0,0,0,0,0,0,0,0,0,0,0,0,0,0,0,0,0,0,0,0,1.94,150000.0,30.0,1995-03-09,2027-06-30,16.852825229960576
Everton FC,Jarrad Branthwaite,27/06/2002 (23),England,left,Defender - Centre-Back,13/01/2020,30/06/2030,2,0,0,0,1,0,1,1,0,0,134',2,0,0,0,1,0,1,1,0,0,134',0,0,0,0,0,0,0,0,0,0,0,0,0,0,0,0,0,0,0,0,0,0,1.95,45000000.0,23.0,2002-06-27,2030-06-30,52.858081471747695
Everton FC,James Tarkowski,19/11/1992 (33),England  Poland,right,Defender - Centre-Back,02/07/2022,30/06/2028,27,0,0,1,4,0,0,0,0,0,2.460',24,0,0,1,4,0,0,0,0,0,2.160',0,0,0,0,0,0,0,0,0,0,0,1,0,0,0,0,0,0,0,0,0,120',1.85,7000000.0,33.0,1992-11-19,2028-06-30,28.876478318002626
Everton FC,Michael Keane,11/01/1993 (33),England  Ireland,right,Defender - Centre-Back,03/07/2017,30/06/2026,22,3,0,0,0,1,0,1,0,0,1.948',20,3,0,0,0,1,0,1,0,0,1.768',0,0,0,0,0,0,0,0,0,0,0,0,0,0,0,0,0,0,0,0,0,0,1.88,4000000.0,33.0,1993-01-11,2026-06-30,4.862023653088042
Everton FC,Vitaliy Mykolenko,29/05/1999 (26),Ukraine,left,Defender - Left-Back,01/01/2022,30/06/2026,23,0,0,0,4,0,1,3,0,0,2.000',20,0,0,0,4,0,0,1,0,0,1.796',0,0,0,0,0,0,0,0,0,0,0,1,0,0,0,0,0,0,1,0,0,104',1.8,25000000.0,26.0,1999-05-29,2026-06-30,4.862023653088042
Everton FC,Adam Aznou,02/06/2006 (19),Morocco  Spain,left,Defender - Left-Back,29/07/2025,30/06/2029,4,0,0,1,0,0,1,1,0,0,295',0,0,0,0,0,0,0,0,0,0,0,0,0,0,0,0,0,0,0,0,0,0,1,0,0,1,0,0,1,0,0,0,34',1.78,7000000.0,19.0,2006-06-02,2029-06-30,40.86727989487516
Everton FC,Jake O'Brien,15/05/2001 (24),Ireland,right,Defender - Right-Back,30/07/2024,30/06/2028,27,0,0,1,1,0,3,2,0,0,2.243',24,0,0,1,1,0,2,2,0,0,2.030',0,0,0,0,0,0,0,0,0,0,0,1,0,0,0,0,0,0,0,0,0,120',1.97,16000000.0,24.0,2001-05-15,2028-06-30,28.876478318002626
Everton FC,Nathan Patterson,16/10/2001 (24),Scotland,right,Defender - Right-Back,04/01/2022,30/06/2027,8,0,0,0,1,0,3,4,0,0,445',6,0,0,0,0,0,3,2,0,0,239',0,0,0,0,0,0,0,0,0,0,0,1,0,0,0,0,0,0,1,0,0,116',1.89,10000000.0,24.0,2001-10-16,2027-06-30,16.852825229960576
Everton FC,Séamus Coleman,11/10/1988 (37),Ireland,right,Defender - Right-Back,01/01/2009,30/06/2026,5,0,0,0,0,0,2,2,0,0,180',3,0,0,0,0,0,2,1,0,0,12',0,0,0,0,0,0,0,0,0,0,0,0,0,0,0,0,0,0,0,0,0,0,1.77,300000.0,37.0,1988-10-11,2026-06-30,4.862023653088042
Everton FC,James Garner,13/03/2001 (24),England,right,Midfield - Defensive Midfield,01/09/2022,30/06/2030,27,3,0,3,6,0,0,1,0,0,2.454',24,2,0,3,5,0,0,1,0,0,2.154',0,0,0,0,0,0,0,0,0,0,0,1,1,0,0,0,0,0,0,0,0,120',1.82,25000000.0,24.0,2001-03-13,2030-06-30,52.858081471747695
